SODR,7UP Free / Zero Sparkling Lemon & Lime Drink 6x330ml
SODR,Tango Dark Berry Sugar Free 6x330ml
SODR,R Whites Lemonade 2L
SODR,R Whites Diet Lemonade 2L
SODR,7up Free / Zero Cherry 6x330ml
SODR,Tango Orange 2L
SODR,7up Free / Zero Cherry 2L
SODR,Tango Dark Berry Sugar Free 2L
SODR,7up 2 Litres
SODR,7UP Free Lemon & Lime Can 24x330ml
SODR,Coca-Cola Original Taste 24x330ml
SODR,Coca-Cola Original Taste 8x330ml
SODR,Diet Coke No Caffeine 8 x 330ml
SODR,Diet Coke 8x330ml
SODR,Diet Coke 12x330ml Cans
SODR,Coca-Cola Zero Sugar 8x330ml
SODR,Coca-Cola Original Taste 1.75L
SODR,Diet Coke 2L
SODR,Coca-Cola Zero Sugar 2L
SODR,Diet Coke 4x1.5L
SODR,Diet Coke No Caffeine 2L
SODR,Coca-Cola Zero Sugar Cherry 2L
SODR,Coca-Cola Cherry 1.75L
SODR,Coca-Cola Zero Sugar Vanilla 2L
SODR,Diet Coke 500ml
SODR,Coca-Cola Original Taste 500ml
SODR,Monster Energy Drink Ultra Fiesta Mango 4x500ml
SODR,Diet Coke Sublime Lime 2L
SODR,Pepsi Max Cans 24x330ml
SODR,Pepsi Max Cans 8x330ml
SODR,Pepsi Max Cherry 2L
SODR,Pepsi Max Cherry Cans 8x330ml
SODR,Pepsi Max Lime No Sugar Cola Bottle 2L
SODR,Diet Pepsi 2L
SODR,Pepsi 2L (Sugar levy applied)
SODR,Pepsi Max No Caffeine 8x330ml
SODR,Diet Pepsi Caffeine Free Cans 8x330ml
SODR,Pepsi Max 1.25L
SODR,"Sainsbury's Diet Ginger Beer, No Added Sugar 2L"
SODR,"Sainsbury's Ginger Beer, Diet x6 330ml"
SODR,"Sainsbury's Diet Cream Soda, No Added Sugar 2L"
SODR,Old Jamaica Ginger Beer 1.5L
SODR,"Sainsbury's Diet Cream Soda, No Added Sugar 6x330ml"
SODR,IRN-BRU Xtra Sugar Free Soft Drink 2lL
SODR,Old Jamaica Ginger Beer 4x330ml
SODR,"Old Jamaica Ginger Beer, Diet 1.5L"
SODR,"Sainsbury's Diet Dandelion & Burdock, No Added Sugar 2L"
SODR,Ben Shaws Shandy 6x330ml
SODR,Sainsbury's Dandelion & Burdock Diet x6 330ml
SODR,Bundaberg Ginger Beer 4x375ml
SODR,IRN-BRU Soft Drink 2l
SODR,Red Bull Energy Drink 12x250ml (Sugar levy applied)
SODR,"Red Bull Sugarfree, Energy Drink 12x250ml"
SODR,"Red Bull Fruits Energy Drink, the Tropical Edition 4x250ml"
SODR,"Red Bull Sugarfree, Energy Drink 8x250ml"
SODR,"Red Bull Sugarfree The Tropical Edition, 250ml"
SODR,Red Bull Watermelon 250ml
SODR,Red Bull Tropical Edition Energy Drink 250ml
SODR,"Red Bull Apricot Strawberry Energy Drink, Summer Edition 250ml"
SODR,Red Bull Sugar Free Energy Drink 473ml
SODR,"Red Bull Sugarfree, Energy Drink 355ml"
SODR,"Red Bull Sugarfree, Energy Drink 250ml"
SODR,Dr Pepper 6x250ml
SODR,Fentimans Ginger Beer 6x150ml
SODR,Fentimans Rose Lemonade 6x150ml
SODR,Pepsi Max 24 X 330Ml
SODR,Diet Coke 24 X 330 Ml Pack
SODR,Coca Cola Regular 24 X 330 Ml Pack
SODR,Pepsi Max Cherry 2L
SODR,Pepsi Max Cola Bottle
SODR,Diet Coke Caffeine Free 2 Litre
SODR,Diet Coke 2L
SODR,Fanta Watermelon Zero Sugar 500Ml
SODR,Old Jamaica Ginger Beer 330Ml
SODR,7 Up Light Lemon  Lime 2 Litre Bottle
SODR,Tango Paradise Punch Sugar Free 500Ml
SODR,Tesco Diet Lemonade 330Ml
SODR,Schweppes Lemonade 2Litre Bottle
SODR,Tesco No Added Sugar Ginger Beer 330Ml
SODR,Tesco Orange Zero 2L
SODR,Tesco Lemon  Lime Zero 330Ml
SODR,Tesco Lemonade 330Ml
SODR,Tesco Orange Zero 330Ml
SODR,Tesco Sparkling Lemonade 2L Bottle
SODR,Tesco Xero Cola 2L
SODR,Tesco Diet Cola 2L Bottle
SODR,Pepsi Max Cherry Cans 24 X 330Ml
SODR,Fanta Lemon 8 X 330Ml
SODR,Dr Pepper 8X330ml
SODR,Fanta Orange Zero 8X330ml
SODR,Orangina Sparkling Orange Drink 6 X 330Ml
SODR,Dr Pepper Zero 2L Bottle
SODR,Fanta Orange Zero 2L
SODR,Tesco No Added Sugar Cloudy Lemonade 2L Bottle
SODR,Tesco No Added Sugar Smooth Cream Soda 2L
SODR,Tesco No Added Sugar Fiery Ginger Beer 2L Bottle
SODR,Tesco Fizzio Zero 2 Litre
SODR,Tesco No Added Sugar Pink Lemonade 2L
SODR,Fanta Pineapple  Grapefruit Zero Sugar 2 Litre
SODR,Tesco Xero Cola Cherry 2 Litre
SODR,San Pellegrino Sparkling Lemon Drink 6 X 330Ml
SODR,Monster Energy Ultra Rosa Sugar Free Drink 500Ml
SODR,Coca Cola 125 Litre
SODR,Irn Bru Xtra 2Ltr
SODR,Lipton Ice Tea Peach Flavour 125L Bottle
SODR,Lipton Ice Tea Lemon Flavour 125L Bottle
SODR,Tesco Classic Diet Caffeine Free Cola 2 Litre
SODR,Coca Cola Zero Sugar 150Ml
SODR,Tango Orange Drink 2 Litre Bottle
SODR,Tango Apple Sugar Free 18 X 330Ml
SODR,Tango Orange Original 18 X 330Ml
SODR,Sprite Can 150Ml
SODR,Bundaberg Ginger Beer 4 X 375Ml
SODR,Irn Bru Xtra 8X330ml
SODR,Fanta Orange Can 150Ml
SODR,Vimto Zero Carbonated Fruit Juice 6X330ml
SODR,Coca Cola Regular 150Ml
SODR,Fever Tree Light Sicilian Lemonade 500Ml
SODR,Oasis Summer Fruit 15Ltr N
SODR,Rubicon Sparkling Mango Juice Drink 330Ml
SODR,Dr Pepper Can 150 Ml
SODR,Belvoir Raspberry Lemonade 750Ml
SODR,Fever Tree Refreshingly Light Rose Lemonade 500Ml
SODR,Oasis Citrus Punch 500Ml N
SODR,Belvoir Farm Botanical Soda Floral Fizz 500Ml
SODR,Orangina 420Ml
SODR,San Pellegrino Sparkling Orange Drink 330Ml
SODR,Lucozade Energy Original 900ml
SODR,Sainsbury's Blue Bolt Zero 6x250ml
SODR,Lucozade Energy Zero Pink 900ml
SODR,Lucozade Energy Original 12x330ml
SODR,Monster Energy Drink Mango Loco 4x500ml
SODR,Lucozade Energy Orange 12x330ml
SODR,Monster Energy Drink 4x500ml
SODR,Monster Energy Drink Pipeline Punch 4x500ml
SODR,Lucozade Sport Fruit Punch 4 X 500ml
SODR,Purdey's Natural Energy Rejuvenate Grape & Apple 4x250ml
SODR,Monster Energy Drink Ultra Paradise 4x500ml
SODR,Sainsbury's Pink Bolt Zero Strawberry & Kiwi 250ml
SODR,Relentless Origin Energy Drink 4x500ml
SODR,Gatorade Cool Blue 500ml
SODR,Lucozade Energy Orange 500ml
SODR,"Red Bull Fruits Energy Drink, the Tropical Edition 4x250ml"
SODR,Relentless Cherry Energy Drink 500ml
SODR,Monster Energy Drink Pacific Punch 4x500ml
SODR,Monster Energy Drink Ultra Gold  4x500ml
SODR,Tiger Energy Drink 250ml
SODR,Tiger Zero No Sugar Energy Drink 250ml
SODR,Red Bull Watermelon 250ml
SODR,Monster Energy Drink Ultra 500ml
SODR,Mountain Dew Citrus Blast 500ml
SODR,Relentless Raspberry Zero Energy Drink 500ml
SODR,Rubicon Raw Raspberry & Blueberry Energy Drink 4x500ml
SODR,Monster Energy Drink Khaotic 500ml
SODR,Rubicon Raw Orange & Mango Energy Drink 4x500ml
SODR,Emerge Zero Sugar Energy Drink 250ml
SODR,Oshee Vitamin Cocktail 250ml
SODR,Monster Energy Drink Rossi VR46 500ml
SODR,Red Bull Energy Drink 250ml (Sugar levy applied)
SODR,Oshee Vitamin Cocktail 250ml
SODR,Monster Energy Ultra 9 X 500Ml
SODR,Monster Energy Ultra Fiesta Zero Sugar Mango 9X500ml
SODR,Red Bull Energy Drink 8 X 250Ml
SODR,Ufit High Protein Milkshake White Chocolate Flavoured 330Ml
SODR,Ufit High Protein Milkshake Drink Strawberry 330Ml
SODR,Tesco Blue Spark 6X250ml
SODR,For Goodness Shakes Protein Chocolate 475Ml
SODR,Red Bull Energy Drink 4 X 250Ml
SODR,Tesco Blue Spark Sugar Free Drink 6X250ml
SODR,Emmi Caffe Latte Cappuccino Mr Big 370Ml
SODR,Lucozade Sport Raspberry 4X500ml
SODR,Lucozade Sport Orange 4X500ml
SODR,Costa Coffee Caramel Latte 250Ml
SODR,Emmi Caffe Latte Cappuccino 230Ml
SODR,Emmi Caffe Latte Skinny 230Ml
SODR,Pro Milk Chocolate Protein Shake 330Ml
SODR,Lucozade Sport Zero Sugar Raspberry  Passion Fruit 4X500ml
SODR,Tesco Blue Spark Sugar Free Energy Drink 1L
SODR,Lucozade Sport Zero Sugar Orange  Peach 4X500ml
SODR,Lucozade Zero Sugar Pink Lemonade 900Ml
SODR,Arctic Coffee Cafe Latte 1 Litre
SODR,Starbucks Skinny Latte 220Ml
SODR,Lucozade Energy Original Fridge Pack 4 X 380Ml
SODR,Arctic Coffee Caramel Latte 1L
SODR,Tesco Blue Spark Original 1L
SODR,Monster Energy 500 Ml Can
SODR,Relentless Origin 500Ml
SODR,Mighty Shake Banana  Oat 330Ml
SODR,Red Bull Energy Drink 355Ml
SODR,Red Bull Energy Drink 473Ml
SODR,Lucozade Energy Original 900Ml
SODR,Lucozade Energy Orange 900Ml
SODR,Rockstar Refresh Strawberry  Lime 500Ml
SODR,Rubicon Raw Energy Pineapple  Passion Fruit 500Ml
SODR,Volvic Touch Of Fruit Lemon And Lime 6X500ml
SODR,No.1 Living Cognitive Kombucha Shot 60ml
SODR,No.1 Living Immune Kombucha Shot 60ml
SODR,Sainsbury's Smooth Pure Orange Juice 1L
SODR,"Sainsbury's 100% Pure Squeezed Smooth Orange Juice, Not From Concentrate 1L"
SODR,"Sainsbury's 100% Pure Squeezed Smooth Orange Juice, Not From Concentrate 1.75L"
SODR,"Sainsbury's 100% Pressed Apple Juice, Not From Concentrate 1L"
SODR,Sainsbury's Pure Apple Juice 1L
SODR,Tropicana Pure Smooth Orange Fruit Juice 900ml
SODR,"Sainsbury's 100% Pure Squeezed Orange Juice with Bits, Not From Concentrate 1L"
SODR,Sainsbury's Pure Apple Juice 6x200ml
SODR,Innocent Pure Orange Juice Smooth 1.35L
SODR,"Sainsbury's 100% Apple Juice, Not From Concentrate 1.75L"
SODR,"Sainsbury's 100% Pure Squeezed Pineapple Juice, Not From Concentrate 1L"
SODR,"Sainsbury's 100% Pure Squeezed Orange Juice with Bits, Not From Concentrate 1.75L"
SODR,Actimel Multifruit Cultured Yogurt Drink 8x100g
SODR,Sainsbury's Smooth Pure Orange Juice 2L
SODR,Sainsbury's Pure Orange Juice 6x200ml
SODR,Tropicana Original Orange Fruit Juice with Bits 900ml
SODR,"Sainsbury's Apple & Mango Juice, Not From Concentrate 1L"
SODR,"Sainsbury's Freshly Squeezed Orange Juice with Bits, Taste the Difference 1L"
SODR,Copella Cloudy Apple Fruit Juice 1.35L
SODR,Sainsbury's Pure Orange Juice with Juicy Bits 1L
SODR,Benecol Original No Added Sugar Yogurt Drink 6x67.5g
SODR,Benecol Raspberry No Added Sugar Yogurt Drink 6x67.5g
SODR,Innocent Apple Juice 1.35L
SODR,Actimel Strawberry Cultured Yogurt Drink 12x100g
SODR,Happy Monkey Strawberry & Banana Kids Smoothie 4x180ml
SODR,Actimel Blueberry Cultured Yogurt Drink 8x100g
SODR,Actimel Original 0% Added Sugar Fat Free Yogurt Drink 8x100g
SODR,"Sainsbury's 100% Pure Squeezed Pink Grapefruit Juice, Not From Concentrate 1L"
SODR,Actimel Multifruit Cultured Yogurt Drink 12x100g
SODR,"Sainsbury's Freshly Squeezed Smooth Orange Juice, Taste the Difference 1L"
SODR,"Sainsbury's Apple & Pear Juice, Not From Concentrate 1L"
SODR,Tropicana Pure Smooth Orange Fruit Juice 1.7L
SODR,"Innocent Kids Smoothies, Strawberries, Raspberries & Apples with Vitamins 10x150ml"
SODR,Benecol Peach & Apricot No Added Sugar Yogurt Drink 6x67.5g
SODR,"Sainsbury's Tropical Juice, Not From Concentrate 1L"
SODR,"Sainsbury's Orange & Mango Juice, Not From Concentrate 1L"
SODR,Innocent Smoothie  Strawberry & Bananas 750ml
SODR,Innocent Orange Juice Smooth 135L
SODR,Innocent Kids Smoothies Apple  Blackcurrant 4X150ml
SODR,Innocent Apple Juice 135L
SODR,Innocent Kids Orange Mango  Pineapple 4X150ml
SODR,Innocent Kids Strawberry Raspberry  Apple 4X150ml
SODR,Tropicana Original Orange Juice With Juicy Bits 17L
SODR,Tropicana Smooth Orange Juice With No Juicy Bits 17L
SODR,Ufit Strawberry 22G Protein Milkshake 310Ml
SODR,Don Simon My First Juice Apple 4X125ml
SODR,Tesco Cranberry Juice 1 Litre
SODR,Tesco Pressed Apple Juice Not From Concentrate 1 Litre
SODR,Tesco Mango Passion Fruit Smoothie 750Ml
SODR,Tropicana Original Orange With Juicy Bits 900Ml
SODR,Tesco Strawberry Sensation Smoothie 750Ml
SODR,Tesco Pure Apple Juice 1 Litre
SODR,Tropicana Smooth Orange Juice 900Ml
SODR,Tesco 100 Pure Not From Concentrate Squeezed Juice Clementine 1L
SODR,Tesco Apple  Mango Juice Not From Concentrate 1 Litre
SODR,Tesco 100 Pure Squeezed Breakfast Juice Not From Concentrate 1 Litre
SODR,Tesco Orange Juice With Bits Not From Concentrate 1L
SODR,Tesco 100 Pure Squeezed Orange Juice Smooth Not From Concentrate 1L
SODR,Tesco No Added Sugar Cranberry Juice Drink 1 Litre
SODR,Tesco Tomato Juice 1 Litre
SODR,Happy Monkey Strawberries  Bananas 4 Pack
SODR,Tesco Cranberry Juice Drink 1L
SODR,Growers Harvest Pure Apple Juice 2 Litre
SODR,Tesco Tropical Juice Drink 1 Litre
SODR,Ocean Spray Cranbery Classic Juice Drink 1Ltr
SODR,Ocean Spray Cranberry Classic Light Juice Drink 1 Litre
SODR,Tesco 100 Squeezed  Pressed Orange  Mango Juice Not From Concentrate 1L
SODR,Tesco Apple And Mango From Concentrate 1 Litre
SODR,Tesco Orange Juice With Bits Not From Concentrate 175L
SODR,Tesco Pure Orange Juice Smooth 1 Litre
SODR,Tesco Orange Juice Smooth Not From Concentrate 175L
SODR,Tesco Pink Grapefruit 1 Litre
SODR,Growers Harvest No Added Sugar Apple Juice Drink 1 Litre
SODR,Growers Harvest Pure Apple Juice 1 Litre
SODR,Growers Harvest Pure Apple Juice 1 Litre
SODR,Growers Harvest Tropical Juice Drink 2L
SODR,T100 Pure Pressed Pineapple Juicenfc 1 Litre
SODR,Growers Harvest Orange Juice Drink No Added Sugar 1Litre
SODR,Growers Harvest Orange Juice Smooth 2L
SODR,Tesco Pineapple Juice 1 Litre
SODR,Growers Harvest Orange Juice Smooth 1 Litre
SODR,Growers Harvest Orange Juice Smooth 1L
SODR,Growers Harvest Orange Juice With Bits 1L
SODR,Innocent Kids Strawberry Raspberry  Apple 10X150ml
WATR,Volvic Touch of Fruit Sugar Free Lemon & Lime Flavoured Water 1.5L
WATR,Volvic Touch of Fruit Sugar Free Strawberry Flavoured Water 1.5L
WATR,Volvic Touch of Fruit Sugar Free Summer Fruits Flavoured Water 1.5L
WATR,"Sainsbury's Sparkling Flavoured Water, Blackcurrant & Cherry 1L"
WATR,Sainsbury's No Added Sugar Sparkling Apple & Elderflower Flavoured Spring Water 1L
WATR,"Sainsbury's Sparkling Flavoured Water, Strawberry & Kiwi 1L"
WATR,"Sainsbury's Still Flavoured Water, Strawberry & Kiwi 1L"
WATR,"Sainsbury's Still Flavoured Water, Lemon & Lime 1L"
WATR,Nexba Naturally Sugar Free Elderflower & Lemon Kombucha 1L
WATR,Volvic Touch of Fruit Sugar Free Special Edition Mango Passion Flavoured Water 1.5L
WATR,Sainsbury's Raspberry & Rhubarb Sparkling Water 1L
WATR,"Sainsbury's Sparkling Flavoured Water Lemon & Lime, No Added Sugar 4x500ml"
WATR,Aqua Libra Sparkling Water Infused with Cucumber Mint & Lime 4x330ml
WATR,Volvic Touch of Fruit Sugar Free Watermelon Flavoured Water 1.5L
WATR,Trip CBD Infused Elderflower Mint 4x250ml
WATR,Volvic Touch of Fruit Sugar Free Peach & Raspberry Natural Flavoured Water 1.5L
WATR,Trip CBD Infused Peach Ginger 4x250ml
WATR,Sainsbury's No Added Sugar Mineral Water Fruit Slurps Blackcurrant Flavoured 6 x 250ml
WATR,Aqua Libra Sparkling Water Infused with Raspberry & Blackcurrant 4x330ml
WATR,Dash British Sparkling Spring Water Infused with Raspberry 4 x 330ml
WATR,Volvic Touch of Fruit Strawberry Flavoured Water 1.5L
WATR,No.1 Living Sugar Free Kombucha Ginger with Turmeric 4x250ml
WATR,"Sainsbury's Sparkling Flavoured Water Strawberry & Kiwi, No Added Sugar 4x500ml"
WATR,Sainsbury's No Added Sugar Fruit Slurps Orange & Pineapple Flavoured 6x250ml
WATR,No.1 Living Sugar Free Kombucha Raspberry with Pomegranate 4x250ml
WATR,Dash Water Peach Infused Sparkling Water 4x330ml
WATR,Fruit Shoot Hydro Blackcurrant Kids Water Drink 8x200ml
WATR,Aqua Libra Sparkling Water Infused with Blood Orange & Mango 4x330ml
WATR,Perfectly Clear Still Red Apple Flavour Spring Water 1.5L
WATR,Volvic Touch of Fruit Lemon & Lime Flavoured Water 1.5L
WATR,Ocean Spray Sparkling Water Cranberry 1L
WATR,Volvic Touch of Fruit Summer Fruits Flavoured Water 1.5L
WATR,Nexba Kombucha Mango 1L
WATR,"Sainsbury's Cucumber, Lime & Mint Sparkling Water 1L"
WATR,Ocean Spray Sparkling Water Cranberry & Raspberry 1L
WATR,Perfectly Clear Still Summer Fruits Flavour Spring Water 1.5L
WATR,Volvic Touch Of Fruit Strawberry 6X500ml
WATR,Tesco Water Splash Blackcurrant 12X300ml
WATR,Volvic Touch Of Fruit Lemon And Lime 15Ltr
WATR,Volvic Touch Of Fruit Lemon  Lime Sugar Free 15Ltr
WATR,Volvic Touch Of Fruit Strawberry Sugar Free 15 Litre
WATR,Get More Vitamin D Still Mango  Passion Fruit 1Ltr
WATR,Get More Vitamins Peach  Apricot SFree Still 1L
WATR,Get More Vitamins B12 Pink Grapefruit Sugar Free Still 1L
WATR,Tesco Lemon  Lime Flavoured Still Water 4X500ml
WATR,Tesco Strawberry Flavoured Still Water 4X500ml
WATR,Tesco Summer Fruits Still Flavoured Water 1L
WATR,Rubicon Spring Water Black Cherry Raspberry 15L
WATR,Tesco Strawberry Still Flavoured Water 1Ltr
WATR,Tesco Lemon  Lime Still Flavoured Water 1Ltr
WATR,Volvic Touch Of Fruit Lemon  Lime 750Ml
WATR,Tesco Still Pear  Plum Flavoured Water 1L
WATR,Volvic Touch Of Fruit Peach  Raspberry Natural Flavoured Water 15 Litre
WATR,Get More Vitamin D 500 Ml
WATR,Volvic Touch Of Fruit Strawberry 750Ml
WATR,Volvic Touch Of Fruit Strawberry 15Ltr
WATR,Volvic Touch Of Fruit Pineapple  Orange Flavoured Water 15Ltr
WATR,Volvic Touch Of Fruit Summer Fruits 15Ltr
WATR,Volvic Touch Of Fruit Sugar Free Apple  BCurnt Water 15L
WATR,S Pellegrino Essenza Dark Cherry  Pomegranate 6X330ml
WATR,Dash Raspberry Infused Sparkling Water 4X330ml
WATR,Dash Mango Infused Sparkling Water 4X330ml
WATR,Dash Peach Infused Sparkling Water 4X330ml
WATR,Highland Spring Pear  Elderflower Spring Water 4X330ml
WATR,Highland Spring Blackberry Plum Spring Water 4X330ml
WATR,Rubicon Orange  Mango Sparkling Water 4X330ml
WATR,Aqua Libra Water Sparkling Raspberry  Blackcurrant 4X330ml
WATR,Aqua Libra Sparkling Water Cucumber Mint Lime4x330ml
WATR,Highland Spring Water Pear  Elderflower Sparkling 330Ml
WATR,Rubicon Spring Black Cherry  Raspberry 500Ml
WATR,Innocent Tropical Juice 135 Litres
WATR,Innocent Orange Juice With Bits 135L
WATR,Evian Natural Mineral Water 6x1.5L
WATR,Evian Natural Mineral Water 6x500ml
WATR,Evian Natural Mineral Water 4x750ml (Sports Cap)
WATR,Buxton Still Natural Mineral Water 8x500ml
WATR,Buxton Still Natural Mineral Water 6x1.5L
WATR,Volvic Mineral Water 6x1.5L
WATR,Evian Natural Mineral Water 12x330ml
WATR,Evian Natural Mineral Water 1.5L
WATR,Volvic Mineral Water 6x500ml
WATR,Volvic Mineral Water 1.5L
WATR,Evian Natural Mineral Water 750ml (Sports Cap)
WATR,Evian Natural Mineral Water 1L
WATR,Buxton Still Natural Mineral Water 1.5L
WATR,AQUA Carpatica Kids Natural Still Mineral Water 6x250ml
WATR,Evian Natural Mineral Water 500ml
WATR,Aqua Pura Still Natural Mineral Water 12x500ml
WATR,Buxton Still Natural Mineral Water Sports Cap 1L
WATR,Aqua Carpatica Natural Still Mineral Water 1.5L
WATR,Highland Spring Still Water 6 X 15L
WATR,Highland Spring Still Bottled Water 12 X 500Ml
WATR,Ice Valley Spring Water Still 24X500ml
WATR,Evian Natural Mineral Water 6X15Ltr
WATR,Aqua Pura Still Natural Mineral Water 12X500ml
WATR,Highland Still Spring Water 12 X 330Ml
WATR,Evian Water 1L
WATR,Rubicon Black Cherry Raspberry Sparkling Water 4X330ml
WATR,Tesco Elmhurst English Still Water 6 X 2 Litre
WATR,Buxton Natural Mineral Water Still 6 X 15Ltr
WATR,Highland Spring Still Water 15 Litre
WATR,Volvic Natural Mineral Water 15L
WATR,Tesco Ashbeck 5Ltr
WATR,Buxton Still Water 15Ltr
WATR,Evian Natural Mineral Water 15 Litres
WATR,Evian Natural Mineral Water 6 X 500 Ml
WATR,Nestle Pure Life Water 12X500ml
WATR,Tesco Ashbeck Natural Mineral Water Sport 6X500ml
WATR,Evian Still 4X75cl
WATR,Tesco Ashbeck Still Water 2Ltr
WATR,Buxton Natural Mineral Water Still 8 X 500 Ml
WATR,Tesco Elmhurst Natural Mineral Still Water 12X500ml
WATR,Volvic Sports Cap Water 1Ltr
WATR,Actiph Alkaline Ionised Water 6X600ml
CTCC,Nescafe Original Decaf Instant Coffee 300g
CTCC,Sainsbury's Gold Roast Instant Coffee 200g
CTCC,Nescafe Azera Americano Instant Coffee 140g
CTCC,Coffee Mate Coffee Whitener 450g
CTCC,"Sainsbury's Fairtrade Italian Style Coffee, Strength 4 227g"
CTCC,Kenco Smooth Instant Coffee 200g
CTCC,Kenco Latte Instant Coffee Sachets 130.4g
CTCC,Kenco Decaff Instant Coffee 200g
CTCC,Lavazza Qualita Rossa Ground Coffee 2x250g
CTCC,Sainsbury's Gold Roast Decaffeinated Instant Coffee Granules 200g
CTCC,"Sainsbury's Fairtrade Colombian Coffee, Taste the Difference, Strength 3 227g"
CTCC,"Sainsbury's Fairtrade House Blend Original Coffee, Strength 3 227g"
CTCC,Kenco Rich Instant Coffee 200g
CTCC,Taylors of Harrogate Rich Italian Ground Coffee 227g
CTCC,Nescafe Gold Cappuccino Instant Coffee Sachets x12 15.5g
CTCC,Taylors of Harrogate Rich Italian Coffee Bags x10
CTCC,Taylors of Harrogate Lazy Sunday Ground Coffee 227g
CTCC,Nescafe Gold Vanilla Latte Instant Coffee Sachets x8
CTCC,Nescafe Gold Caramel Latte Instant Coffee Sachets x8
CTCC,Sainsbury's Rich Roast Instant Coffee 200g
CTCC,Sainsbury's Gold Roast Instant Coffee 500g
CTCC,Kenco Cappuccino Instant Coffee x8 Sachets
CTCC,Kenco Decaff Instant Coffee Refill 150g
CTCC,Nescafe Gold Latte Instant Coffee Sachets x8 124g
CTCC,"Sainsbury's Fairtrade Decaff House Blend Coffee, Strength 3 227g"
CTCC,Nescafe Gold Double Choc Mocha Instant Coffee Sachets x8
CTCC,Douwe Egberts Pure Gold Instant Coffee 190g
CTCC,Kenco Rich Instant Coffee Refill 150g
CTCC,Lavazza Cafe Decaffeinated Ground Coffee 250g
CTCC,Taylors of Harrogate Lazy Sunday Ground Coffee 454g
CTCC,Taylors of Harrogate Rich Italian Ground Coffee 454g
CTCC,Nescafe Gold Blend Coffee 200G
CTCC,Nescafe Original Instant Coffee 300G
CTCC,Nescafe Azera Americano Instant Coffee 90G
CTCC,Tesco Gold Instant Coffee 200G
CTCC,Taylors Rich Italian Ground Coffee 227G
CTCC,Taylors Lazy Sunday Ground Coffee 227G
CTCC,Lor Classique Instant Coffee 150G
CTCC,Douwe Egberts Pure Gold Coffee 190G
CTCC,Lor Intense Instant Coffee 150G
CTCC,Tesco Classic Instant Coffee 200G
CTCC,Kenco Smooth Instant Coffee 200G
CTCC,Nescafe Azera Americano Intense Instant Coffee 90G
CTCC,Kenco Smooth Instant Coffee Refill 150G
CTCC,Nescafe Gold Smooth Instant Coffee 200G
CTCC,Kenco Millicano Americano Instant Coffee 100G
CTCC,Kenco Rich Instant Coffee Refill 150G
CTCC,Nescafe Original Instant Coffee 100G
CTCC,Lavazza Qualita Rossa Ground Coffee 2 X 250G
CTCC,Taylors Hot Lava Java Ground Coffee 227G
CTCC,Tesco Gold Instant Coffee 500G
CTCC,Stockwell  Co Instant Coffee 100G
CTCC,Tesco Italian Inspired Blend Ground Coffee 454G
CTCC,Nescafe Gold Blend Coffee Refill 150G
CTCC,Kenco Rich Instant Coffee 200G
CTCC,Cadbury Drinking Hot Chocolate 500g
CTCC,Cadbury Hot Chocolate Instant Jar 400g
CTCC,"Ovaltine Malted Drink, Chocolate, Light 300g"
CTCC,Sainsbury's Low Calorie Instant Fairtrade Hot Chocolate 250g
CTCC,Galaxy Instant Hot Chocolate Jar 370g
CTCC,Sainsbury's Instant Fairtrade Hot Chocolate 350g
CTCC,Green & Black's Organic Hot Chocolate 300g
CTCC,Cadbury Hot Chocolate Instant 28g
CTCC,Cadbury Drinking Hot Chocolate 250g
CTCC,Twinings Swiss Hot Chocolate 350g
CTCC,Clipper Fairtrade Instant Hot Chocolate 350g
CTCC,Galaxy Instant Hot Chocolate Sachet 25g
CTCC,Maltesers Malty Hot Chocolate 350g
CTCC,Options Vegan Belgian Hot Chocolate 200g
CTCC,Galaxy Vegan Instant Silky & Smooth Hot Chocolate Drink 250g
CTCC,Options Salted Caramel Hot Chocolate 220g
CTCC,Aero Instant Hot Chocolate Powder Jar 288g
CTCC,Starbucks Signature 42% Cocoa Hot Chocolate Powder Tin 330g
CTCC,Galaxy Hot Chocolate 500g
CTCC,Costa Hot Chocolate 300g
CTCC,"Sainsbury's Fairtrade Belgian Milk Drinking Chocolate, Taste the Difference 280g"
CTCC,Starbucks Signature Chocolate Salted Caramel Flavour Hot Chocolate Powder 10x20g Sachets
CTCC,The Trending Taste Marshmallow Hot Chocolate Stirring Spoon 30g
CTCC,Butlers Hot Chocolate 240g
CTCC,Cadbury Hot Chocolate Cocoa Powder 500G
CTCC,Cadbury Instant Hot Chocolate Cocoa Powder 400G
CTCC,Cadbury Fair Trade Hot Chocolate Instant Stickpack 28G
CTCC,Tesco Drinking Chocolate 400G
CTCC,Stockwell  Co Hot Chocolate 375G
CTCC,Cadbury Hot Chocolate Cocoa Powder 250G
CTCC,Options Hot Chocolate Salted Caramel 220G
CTCC,Options Belgian Chocolate 220G
CTCC,Galaxy Light Instant Hot Chocolate 210G
CTCC,Twinings Luxury Chocolate Drink 350G
CTCC,Cadbury Highlights Milk Chocolate Jar 220G
CTCC,Tesco Pink  White Marshmallows 100G
CTCC,Options Vegan Belgian Hot Chocolate Drink 200G
CTCC,Starbucks Signature 42 Cocoa Hot Chocolate 330G
CTCC,Tesco Finest Belgian Hot Chocolate Flakes 200G
CTCC,Naturya Organic Hot Chocolate 250G
CTCC,Options Mint Madness 220G
CTCC,Options Instant Belgian Chocolate Sachet 11G
CTCC,Green  Blacks Organic Cocoa Fair Trade 125G
CTCC,Tesco White Mini Marshmallows 100G
CTCC,Tesco Cocoa Powder 250G
CTCC,Sweet Freedom Chocolate Shot Liquid Chocolate 320G
CTCC,Tassimo Cadbury Hot Chocolate 8 Pods 240G
CTCC,Twinings 80 English Breakfast T Bags 200G
CTCC,Yorkshire Tea Tea Bags x80
CTCC,"Sainsbury's Earl Grey Coronation Tea Bags 100's, Taste the Difference"
CTCC,Yorkshire Tea Tea Bags x240
CTCC,Sainsbury's Fairly Traded Decaffeinated Red Label x80 Tea Bags 250g
CTCC,PG tips Original Biodegradable Black Tea Bags x240
CTCC,Sainsbury's Fairly Traded Red Label x240 Tea Bags 750g
CTCC,"Tetley Everyday Tea Bags, Softpack x240"
CTCC,Yorkshire Tea Decaf Tea Bags x80
CTCC,Clipper Organic Everyday Tea Bags x80
CTCC,Sainsbury's Fairly Traded Red Label x160 Tea Bags 500g
CTCC,Yorkshire Gold Tea Bags x80
CTCC,Sainsbury's Fairly Traded Red Label x80 Tea Bags 250g
CTCC,PG tips Original Biodegradable Black Tea Bags x80
CTCC,Tetley Everyday Tea Bags Decaffeinated x80 250g
CTCC,"Tetley Everyday Tea Bags, Softpack x80"
CTCC,PG tips Original Biodegradable Black Tea Bags x160
CTCC,PG Tips Decaffeinated Biodegradable Tea Bags x140 406g
CTCC,Yorkshire Tea Decaf Tea Bags x160
CTCC,PG Tips Decaffeinated Tea Bags x70 230g
CTCC,Sainsbury's Infusions Peppermint Tea Bags x80
CTCC,"Sainsbury's Earl Grey Decaff Tea Bags, Taste the Difference x50"
CTCC,Sainsbury's Infusions Lemon & Ginger Tea Bags x20
CTCC,Sainsbury's English Breakfast Tea Bags Taste the Difference x80
CTCC,Sainsbury's Assam Tea Bags Taste the Difference x80
CTCC,"Twinings Peppermint Tea, 20 Tea Bags"
CTCC,Yorkshire Tea Hard Water Tea Bags x80
CTCC,Yorkshire Tea Loose Leaf Tea 250g
CTCC,"Twinings Peppermint Tea, 80 Tea Bags"
CTCC,"Twinings Superblends Sleep with Spiced Apple & Camomile, 20 Tea Bags"
CTCC,Tick Tock Rooibos Tea Bags x80
CTCC,"Sainsbury's Earl Grey Tea Bags, Taste the Difference x50"
CTCC,Twinings Strong English Breakfast 80 Tea Bags 250G
CTCC,Yorkshire Tea 210 Tea Bags 656G
CTCC,Tetley Original Tea Bags 600 Pack 1875Kg
CTCC,Tesco Finest English Breakfast 100 Tea Bags 250G
CTCC,Yorkshire Teabags 40S 125G
CTCC,Tetley Softpack 240 Teabags 750G
CTCC,Tesco 80 Teabags 250G
CTCC,Yorkshire 80 Teabags 250G
CTCC,Stockwell  Co 80 Tea Bags 200G
CTCC,Clipper Classic Everyday Tea Bags 80Pk 232G
CTCC,Yorkshire Decaff Teabags 160S 500G
CTCC,Tetley Original 120 Teabags 375G
CTCC,Pukka Organic Night Time 20 Tea Bags 20G
CTCC,Tesco Peppermint 40S 60G
CTCC,Tetley Decaffeinated 160 Teabags 500G
CTCC,Yorkshire Gold 80 Teabags 250G
CTCC,Tesco Lemon  Ginger 40S 80G
CTCC,Pg Tips 40S Pyramid Teabags 116G
CTCC,Yorkshire Tea Malty Biscuit Brew 40 Tea Bags 112G
CTCC,Taylors Yorkshire Leaf Tea 250G
CTCC,Twinings Cranberry And Raspberry 20S 40G
CTCC,Clipper Snore  Peace Chamomile Lemon  Lavender Tea Bags 30G
