BRKF,Nutribrex Gluten Free Cereal 375G
BRKF,Quaker Oat So Simple Gluten Free Original Porridge 10 Pack 350G
BRKF,Nairns Gluten Free Oat Muesli 450G
BRKF,Natures Path Organic Gluten Free Mesa Sunrise Cereal 355G
BRKF,Eat Natural Gluten Free Granola Buckwheat Seeds  Honey 425G
BRKF,Eat Natural Gluten Free Buckwheat Toasted Muesli 500G
BRKF,Eat Natural Gluten Free Ancient Grains Muesli 450G
BRKF,Quaker Oat So Simple Gluten Free Original Porridge 510G
BRKF,Free Gluten Free Supergrain Hoops Organic  Vegan 300G
BRKF,Nairns Gluten Free Scottish Porridge 450G
BRKF,Moma Jumbo Oat Porridge Almond Butter  Salted Caramel 6X35g
BRKF,Free Gluten Free Chocolate Stars Organic  Vegan 300G
BRKF,Tesco Free From Berry Granola 350G
BRKF,Tesco Free From Gluten Syrup Porridge Pot 55G
BRKF,Tesco Free From Original Porridge Pot 55G
BRKF,Delicious Alchemy Dairy  Gluten Free Oats450g
BRKF,Tesco Free From Multigrain Hoops 300G
BRKF,Sainsbury's Deliciously Free From Oats 450g
BRKF,Nature's Path Gluten Free Mesa Sunrise 355g
BRKF,Sainsbury's Deliciously Free From Fruity Muesli 450g
BRKF,Nairn's Gluten Free Scottish Porridge Oats 450g
BRKF,Sainsbury's Deliciously Free From Cornflakes 300g
BRKF,Nature's Path Gluten Free Granola Mixed Berry 312g
BRKF,Nairn's Gluten Free Oat Muesli 450g
BRKF,Sainsbury's Deliciously Free From Rice Pops 300g
BRKF,Kallo Organic Puffed Rice Cereal Gluten Free 225g
BRKF,Nutri-Brex Gluten Free Cereal x24 375g
BRKF,Go Free Gluten Free Corn Flakes 375g
BRKF,Go Free Gluten Free Honey Nut Flakes 350g
BRKF,Go Free Gluten Free Rice Pops 350g
BRKF,Sainsbury's Deliciously Free From Choco Flakes 300g
BRKF,Weetabix 48Pk
BRKF,Kelloggs Crunchy Nut 1Kg
BRKF,Kelloggs Frosties Cereal 925G
BRKF,Kelloggs Crunchy Nut 500G
BRKF,Jordans Country Crisp  Strawberry 500G
BRKF,Rice Krispies Multigrain Cereal 350G
BRKF,Quaker Oat So Simple Golden Syrup Porridge 57G
BRKF,Weetabix Cereal 24 Pack
BRKF,Tesco Scottish Oats Porridge 2Kg
BRKF,Tesco No Added Sugar Swiss Style Muesli 1Kg
BRKF,Tesco Instant Oats Porridge Pot Apple  Blueberry 55G
BRKF,Scotts Porridge Oats 1Kg
BRKF,Nature Valley Crunchy Granola Oats  Honey 5X42g
BRKF,Belvita Soft Bakes Chocolate Chip 250G
BRKF,Kelloggs Corn Flakes 720G
BRKF,Kelloggs Corn Flakes 500G
BRKF,Kelloggs Coco Pops Cereal Bar 6 X 20G
BRKF,Tesco Wheat Biscuits Cereal 24 Pack
BRKF,Tesco Easy Oats Golden Syrup Flavour 8X36g
BRKF,Weetabix Cereal x24
BRKF,Kellogg's Corn Flakes Breakfast Cereal 500g
BRKF,Sainsbury's Wholegrain Malties Cereal 750g
BRKF,Kellogg's Crunchy Nut Breakfast Cereal 720g
BRKF,Weetabix Cereal x48
BRKF,Sainsbury's Scottish Porridge Oats 1.5kg
BRKF,Sainsbury's Honey Nut Cornflakes 500g
BRKF,Kellogg's Fruit 'n Fibre Original Breakfast Cereal 700g
BRKF,Kellogg's Special K Original Breakfast Cereal 750g
BRKF,Cheerios Multigrain 700g
BRKF,"Sainsbury's Fruit, Nut & Seed Muesli 750g"
BRKF,Daily's Porridge Oats 1kg
BRKF,Kellogg's Frosties Breakfast Cereal 470g
BRKF,"Sainsbury's Granola, Raisin, Nut & Honey 1kg"
BRKF,Sainsbury's Rice Pops 375g
BRKF,Kellogg's Rice Krispies Breakfast Cereal 375g
BRKF,Flahavan's Organic Jumbo Oats 1kg
BRKF,Kellogg's Bran Flakes Breakfast Cereal 750g
BRKF,Nestle Shredded Wheat Bitesize Cereal 720g
BRKF,"Sainsbury's Whole Rolled Porridge Oats, Taste the Difference 750g"
BRKF,Quaker Oat So Simple Original Porridge Sachets 10x27g
BRKF,Alpen Muesli No Added Sugar 550g
BRKF,Scott's Porage Original Porridge Oats 1kg
BRKF,Shredded Wheat Cereal Biscuits x30
BRKF,Kellogg's Rice Krispies Breakfast Cereal 660g
BRKF,Sainsbury's Wholegrain Fruit & Fibre 750g
BRKF,Sainsbury's Choco Hazelnut Squares Cereal 375g
BRKF,Sainsbury's Choco Rice Pops 375g
BSOI,Tesco British Salted Block Butter 250G
BSOI,Tesco British Unsalted Butter 250G
BSOI,Anchor Salted Butter 200G
BSOI,Tesco Organic Butter 250G
BSOI,Tesco Organic Unsalted Butter 250G
BSOI,Kerrygold Pure Irish Block Butter 250G
BSOI,Yeo Valley Organic Block Butter 250G
BSOI,Lurpak Unsalted Butter 200G
BSOI,Lurpak Slightly Salted Spreadable 500G
BSOI,President Unsalted Butter 250G
BSOI,Lurpak Lighter Slightly Salted Butter 200G
BSOI,Lurpak Lighter Slightly Salted Spreadable 500G
BSOI,Flora Plant Butter Unsalted 250G
BSOI,"Sainsbury's British Butter, Salted 250g"
BSOI,Lurpak Slightly Salted Spreadable Blend of Butter & Rapeseed Oil 500g
BSOI,"Sainsbury's British Butter, Unsalted 250g"
BSOI,Lurpak Lighter Spreadable Blend of Butter & Rapeseed Oil 500g
BSOI,Sainsbury's Buttersoft Spreadable Butter 500g
BSOI,Anchor Spreadable Blend of Butter & Rapeseed Oil 500g
BSOI,Anchor Salted Butter 200g
BSOI,Kerrygold Pure Irish Butter 250g
BSOI,Country Life British Salted Butter 250g
BSOI,"Sainsbury's British Butter, Salted 500g"
BSOI,Lurpak Unsalted Spreadable Blend of Butter and Rapeseed Oil 500g
BSOI,Lurpak Slightly Salted Butter 200g
BSOI,"Sainsbury's British Butter Slightly Salted, SO Organic 250g"
BSOI,Lurpak Slightly Salted Spreadable Blend of Butter & Rapeseed Oil 250g
BSOI,"Sainsbury's British Butter Unsalted, SO Organic 250g"
BSOI,Kerrygold Softer Butter 250g
BSOI,Anchor Unsalted Butter 200g
BSOI,Anchor Spreadable Blend of Butter & Rapeseed Oil 750g
BSOI,Anchor Lighter Spreadable Blend of Butter & Rapeseed Oil 500g
BSOI,Lurpak Spreadable Blend of Butter and Rapeseed Oil 750g
BSOI,President Spreadable Slightly Salted Butter 250g
BSOI,Anchor Spreadable Blend of Butter & Rapeseed Oil 250g
BSOI,Lurpak Unsalted Butter 200g
BSOI,Vitalite Dairy Free Spread 500G
BSOI,Stockwell  Co Soft Spread 500G
BSOI,Pure Dairy Free Buttery Spread 500G
BSOI,I Cant Believe Its Not Butter Original Spread 450G
BSOI,Clover Original Spread 1Kg
BSOI,Stork Original Baking Spread 1Kg
BSOI,Tesco Buttery Spread 500G
BSOI,Pure Sunflower 500G
BSOI,Tesco Buttery Spread 1Kg
BSOI,I Cant Believe Its Not Butter Light Spread 450G
BSOI,Tesco Buttery Spread 30 Less Fat 500G
BSOI,Stork Original Baking Spread 500G
BSOI,Flora Buttery Spread 1Kg
BSOI,Tesco Baking Spread 500G
BSOI,Tesco Soft Baking Spread 2Kg
BSOI,Clover Original Spread 500G
BSOI,Clover Lighter Spread 500G
BSOI,Flora Light Spread 1Kg
BSOI,Tesco Baking Block 250G
BSOI,Stork Original Baking Block 250G
BSOI,Benecol Buttery Spread 500G
BSOI,Benecol Light Spread 500G
BSOI,Flora Pro Activ Light Spread 250G
BSOI,Clover Spread 500g
BSOI,Bertolli Olive Oil Spread 450g
BSOI,Clover Light Spread 500g
BSOI,Flora Natural Dairy Free Spread 450g
BSOI,Sainsbury's Butterlicious Spread 500g
BSOI,Flora Buttery Spread 450g
BSOI,Flora Lighter Vegan Spread 450g
BSOI,Sainsbury's Olive Spread 500g
BSOI,Benecol Buttery Spread 500g
BSOI,Vitalite Dairy Free Spread 500g
BSOI,Flora ProActiv Buttery Taste Spread 450g
BSOI,Flora Buttery Spread 1Kg
BSOI,Benecol Light Spread 500g
BSOI,Pure Dairy Free Vegan Olive Spread 500g
BSOI,Bertolli Olive Oil Light Spread 450g
BSOI,Sainsbury's Soft Baking Spread 500g
BSOI,Clover Spread 1kg
BSOI,Utterly Butterly Spread 500g
BSOI,Stork Baking Spread Alternative to Butter 1kg
BSOI,Flora Lighter Vegan Spread 1kg
BSOI,"Naturli Vegan Spread, Organic 450g"
BSOI,Benecol Olive Spread 500g
BSOI,Utterly Butterly Lightly Spread 500g
BSOI,Bertolli Spread 250g
BSOI,Flora Lighter Vegan Spread 250g
BSOI,Utterly Butterly Spread 1kg
BSOI,Sainsbury's Olive Spread 1kg
BSOI,Flora ProActiv Olive Spread 450g
BSOI,Clover Light Spread 1kg
BSOI,Tesco Olive Oil 1L
BSOI,Tesco Extra Virgin Olive Oil 1Ltr
BSOI,Filippo Berio Extra Virgin Olive Oil 1Ltr
BSOI,Tesco Olive Oil 250Ml
BSOI,Tesco Olive Oil 500Ml
BSOI,La Espanola Extra Virgin Olive Oil Litre
BSOI,Tesco Extra Virgin Olive Oil 250Ml
BSOI,Tesco Extra Virgin Olive Oil 500Ml
BSOI,Filippo Berio Extra Virgin Olive Oil 500Ml
BSOI,Filippo Berio Olive Oil 1 Litre
BSOI,Farchioni Il Casolare Extra Virgin Olive Oil 1L
BSOI,Napolina Extra Virgin Olive Oil 500Ml
BSOI,Tesco Light In Colour Olive Oil 1Ltr
BSOI,Napolina Extra Virgin Olive Oil 1Ltr
BSOI,Tesco Organic Extra Virgin Olive Oil 500Ml
BSOI,Napolina Olive Oil 500Ml
BSOI,Filippo Berio Mild  Light Olive Oil 1Ltr
BSOI,Napolina Olive Oil 1Lt
BSOI,Filippo Berio Pure Olive Oil 500 Ml
BSOI,Filippo Berio Mild  Light Olive Oil 500Ml
BSOI,Tesco Greek Extra Virgin Olive Oil 500Ml
BSOI,Napolina Olive Oil Spray 200Ml
BSOI,Belazu Crete Gold Extra Virgin Olive Oil 500Ml
BSOI,Napolina Extra Virgin Olive Oil 750ml
BSOI,Napolina Olive Oil 750ml
BSOI,"Sainsbury's Olive Oil, Extra Virgin 1L"
BSOI,Sainsbury's Olive Oil 1L
BSOI,Frylight 1 Cal Extra Virgin Olive Oil Cooking Spray 190ml
BSOI,Sainsbury’s Sunflower & Extra Virgin Olive Oil 500ml
BSOI,Sainsbury's Olive Oil 500ml
BSOI,"Sainsbury's Olive Oil, Extra Virgin 250ml"
BSOI,Il Casolare Unfiltered Extra Virgin Olive Oil 1L
BSOI,Filippo Berio Organic Extra Virgin Olive Oil 500ml
BSOI,"Sainsbury's Olive Oil, Extra Virgin 2L"
BSOI,"Filippo Berio Olive Oil, Extra Virgin 750ml"
BSOI,"Sainsbury's Unfiltered Extra Virgin Olive Oil, SO Organic 500ml"
BSOI,"Sainsbury's Garlic Flavoured Olive Oil, Inspired to Cook 250ml"
BSOI,Napolina Extra Virgin Olive Oil 500ml
BSOI,Sainsbury's Olive Oil 250ml
BSOI,Sainsbury's Extra Virgin Olive Oil Spray 200ml
BSOI,La Espanola Extra Virgin Olive Oil 750ml
BSOI,"Filippo Berio Olive Oil, Extra Virgin 500ml"
BSOI,Napolina Olive Oil 500ml
BSOI,"Sainsbury's Olive Oil, Light In Colour 1L"
BSOI,Karyatis Greek Extra Virgin Olive Oil 500ml
BSOI,Sainsbury's Olive Oil 2L
BSOI,"Sainsbury's Chilli Flavoured Olive Oil, Inspired to Cook 250ml"
BSOI,Filippo Berio Olive Oil 750ml
BSOI,Filippo Berio Extra Virgin Olive Oil 1L
BSOI,Odysea Greek Extra Virgin Olive Oil 500ml
BSOI,Filippo Berio Mild & Light Olive Oil 500ml
CANF,Tesco Tuna Chunks In Spring Water 145G
CANF,Tesco Tuna Chunks In Brine 145G
CANF,Princes Tuna Chunks In Spring Water 4X145g
CANF,Tesco Drained Tuna Steak In Spring Water 110G
CANF,Stockwell  Co Tuna Chunks In Brine 145G
CANF,Princes Tuna Chunks In Brine 4X145g
CANF,Princes Tuna Chunks In Sunflower Oil 4X145g
CANF,Tesco Tuna Chunks In Sunflower Oil 145G
CANF,Tesco Drained Tuna Steak In Brine 110G
CANF,Tesco Drained Tuna Steak In Sunflower Oil 110G
CANF,Tesco Tuna Chunks In Spring Water 3X80g
CANF,Princes Drained Tuna Steak In Spring Water 3X110g
CANF,Rio Mare Tuna In Olive Oil 160G
CANF,Princes Drained Tuna Steak In Sunflower Oil3x110g
CANF,Princes Tuna Chunks In Spring Water 8 X 145G
CANF,Princes Drained Tuna Steak In Brine 3X110g
CANF,Princes Drained Tuna Steak In Spring Water 3X60g
CANF,Princes Drained Tuna Steak In Sunflower Oil 3X60g
CANF,Tesco Baked Beans In Tomato Sauce 420G
CANF,Ortiz El Velero Yellow Fin Tuna in Olive Oil 112g
CANF,Ortiz Bonito Tuna In Olive Oil 158g
CANF,Sainsbury's Tuna Steak in Spring Water 3x120g
CANF,Princes Tuna Chunks in Spring Water 4x145g
CANF,Princes Tuna Chunks in Sunflower Oil 4x145g
CANF,Sainsbury's Tuna Drained & Ready Water 120g
CANF,John West No Drain Fridge Pot Tuna Steak with a Little Spring Water 3 x 110g
CANF,John West Tuna Chunks in Spring Water 4x145g
CANF,Princes Tuna Chunks in Brine 4x145g
CANF,Princes Tuna Chunks in Spring Water 3x80g (3x56g*)
CANF,Sainsbury's Tuna Steak in Sunflower Oil 3x120g
CANF,John West No Drain Fridge Pot Tuna Steak with a Little Olive Oil 3 x 110g
CANF,John West Immunity No Drain Tuna Steak with Springwater 3x110g
CANF,John West Lower Salt Tuna Chunks in Spring Water 3x145g
CANF,Princes Drained & Ready to Use Tuna Steak with a Little Spring Water 3x110g
CANF,Heinz Baked Beans In Tomato Sauce 4X415g
CANF,Branston Beans In Tomato Sauce 410G
CANF,Heinz Baked Beans In Tomato Sauce 415G
CANF,Heinz Beanz No Added Sugar 4 X 415G
CANF,Heinz Baked Beans 3X200g
CANF,Stockwell  Co Baked Beans In Tomato Sauce 420G
CANF,Tesco Baked Beans In Tomato Sauce 220G
CANF,Tesco Reduced Sugar And Salt Baked Beans In Tomato Sauce 420G
CANF,Branston Beans In Tomato Sauce 220G
CANF,Heinz Baked Beans No Added Sugar 4 Pack 4 X 200G
CANF,Heinz Baked Beans No Added Sugar 415G
CANF,Heinz Baked Beans In Tomato Sauce 150G
CANF,Tesco Reduced Sugar  Salt Baked Beans 220G
CANF,Heinz Baked Beans In Tomato Sauce 200G
CANF,Tesco Baked Beans  Pork Sausages In Tomato Sauce 395G
CANF,Heinz Beanz Snap Pots 4X200g
CANF,Heinz Baked Beans  Pork Sausages 415G
CANF,Heinz Beanz No Added Sugar 200G
CANF,Stockwell  Co Baked Beans  Pork Sausages 405G
CANF,Tesco Organic Baked Beans 420G
CANF,Branston Beans  Sausages 405G
CANF,Heinz Beanz Barbecue 390G
CANF,Del Monte Fruit Cocktail In Juice 415G
CANF,Heinz Baked Beans in a Rich Tomato Sauce 4 x 415g
CANF,Heinz Baked Beans in a Rich Tomato Sauce 6 x 415g
CANF,Heinz No Added Sugar Baked Beans in a Rich Tomato Sauce 6 x 415g
CANF,Hubbard's Foodstore Baked Beans In Tomato Sauce 400g
CANF,Heinz Baked Beans in a Rich Tomato Sauce 3 x 200g
CANF,Sainsbury's Baked Beans In Tomato Sauce 200g
CANF,Heinz Baked Beans in a Rich Tomato Sauce 415g
CANF,Branston Baked Beans 4x410g
CANF,"Sainsbury's Baked Beans In Reduced Sugar & Salt, Tomato Sauce 200g"
CANF,Sainsbury's Baked Beans In Tomato Sauce 4x400g
CANF,Sainsbury's Reduced Sugar & Salt Baked Beans In Tomato Sauce 4x400g
CANF,Sainsbury's Reduced Sugar & Salt Baked Beans In Tomato Sauce 400g
CANF,Heinz Baked Beans Snap Pots 4 x 200g
CANF,Sainsbury's Baked Beans 6x400g
CANF,Heinz Baked Beans in a Rich Tomato Sauce 200g
CANF,Heinz Baked Beans in a Rich Tomato Sauce 150g
CANF,Branston Baked Beans 220g
CANF,Sainsbury's Baked Beans in Tomato Sauce 400g
CANF,Branston Baked Beans in a Rich & Tasty Tomato Sauce 6x410g
CANF,Heinz Baked Beans and Sausages 415g
CANF,Heinz No Added Sugar Baked Beans in a Rich Tomato Sauce 4 x 415g
CANF,Heinz Baked Beans and Pork Sausages 200g
CANF,Heinz No Added Sugar Baked Beans in a Rich Tomato Sauce 415g
CANF,"Sainsbury's Baked Beans, SO Organic 400g"
CANF,Branston Baked Beans 410g
CANF,Heinz No Added Sugar Baked Beans in a Rich Tomato Sauce 200g
CANF,Sainsbury's Baked Beans With Meatfree Meat Free Sausages 400g
CANF,Branston Baked Beans & Sausages 405g
CANF,HP Baked Beans 4x415g
CANF,Heinz Baked Beans Barbecue 390g
CANF,Del Monte Peach Slices In Juice 415G
CANF,Tesco Tropical Fruit Salad 425G
CANF,Tesco Evaporated Milk 410G
CANF,Del Monte Fruit Cocktail In Syrup 420G
CANF,Tesco Pineapple Slices In Natural Juice 227G
CANF,Tesco Pear Halves In Juice 410G
CANF,Tesco Pineapple Slices In Juice 425G
CANF,Princes Summer Fruit Filling 410G
CANF,Del Monte Peach Halves In Juice 415G
CANF,Del Monte Pineapple Chunks In Juice 432G
CANF,Del Monte Sliced Pineapple In Juice 435G
CANF,Tesco Basmati Rice 1Kg
CANF,Sainsbury's Peach Slices In Fruit Juice 411g
CANF,Sainsbury's Prunes in Fruit Juice 410g
CANF,Sainsbury's Pineapple Chunks in Fruit Juice 432g
CANF,Del Monte Fruit Cocktail In Juice 415g (250g Drained)
CANF,Sainsbury's Apricot Halves in Fruit Juice 411g
CANF,Sainsbury's Mandarin Segments in Fruit Juice 298g
CANF,Sainsbury's Pear Halves in Refined Fruit Juice 411g
CANF,Sainsbury's Peach Slices In Fruit Juice 213g
CANF,Dole Peaches In Juice Fruit Snacks 4x113g
RICE,Tesco Microwave Basmati Rice 250G
RICE,Tesco Basmati Rice 2Kg
RICE,Tesco Basmati Rice 4Kg
RICE,Laila Basmati Rice 10Kg
RICE,Tilda Pure Original Basmati Rice 10Kg
RICE,Tilda Basmati Rice 1Kg
RICE,Tilda Pure Steamed Basmati Rice Classic 250G
RICE,Akash Basmati Rice 10Kg
RICE,Growers Harvest Microwave Basmati Rice 250G
RICE,Tilda Basmati Rice 500G
RICE,Tilda Pure Original Basmati Rice 5Kg
RICE,Laila Basmati Rice 5Kg
RICE,Tesco Easy Cook Basmati Rice 1Kg
RICE,Kohinoor Extra Flavour Basmati Rice 10Kg
RICE,Tesco Boil In The Bag Basmati Rice 4 X 125G
RICE,Badshah Superior Aged Basmati Rice 5Kg
RICE,Kohinoor Classic Basmati Rice 10Kg
RICE,Akash Gold Basmati Rice 10Kg
RICE,Laila Basmati Rice 2Kg
RICE,Tesco Organic Basmati Rice 500G
RICE,Tesco Jasmine Rice 1Kg
RICE,Ben's Original Classic Basmati Microwave Rice 220g
RICE,Sainsbury's Microwave Rice Basmati 250g
RICE,Sainsbury's Basmati Rice 1kg
RICE,Tilda Microwave Rice Pure Basmati 250g
RICE,Sainsbury's Microwave Rice Brown Basmati 250g
RICE,Tilda Microwave Rice Wholegrain Basmati 250g
RICE,Tilda Microwave Rice Lime & Coriander Basmati 250g
RICE,Tilda Microwave Rice Pilau Basmati 250g
RICE,Tilda Pure Basmati Rice 500g
RICE,Sainsbury's Basmati Rice 500g
RICE,Tilda Pure Basmati Rice 1kg
RICE,Sainsbury's Boil In The Bag Basmati Rice 4x125g
RICE,Veetee Heat& Eat Basmati Rice Pots x2 250g
RICE,Tilda Microwave Rice Wholegrain Pilau Basmati 250g
RICE,Tilda Wholegrain Basmati Rice 1kg
RICE,Sainsbury's Basmati Rice 2kg
RICE,Tilda Pure Basmati Rice 5kg
RICE,Laila Basmati Rice 5kg
RICE,Tilda Boil in Bag Pure Basmati Rice 250g
RICE,Trophy Indian Basmati Rice 10kg
RICE,Tilda Pure Basmati Rice 2kg
RICE,Tesco Thai Hom Mali Aaa Jasmine Fragrant Rice 5Kg
RICE,Tilda Thai Jasmine Rice 500G
RICE,Tesco Microwave Jasmine Rice 250G
RICE,Tilda Jasmine Fragrant Rice 250G
RICE,Veetee Heat Eat Thai Jasmine Rice 2X140g
RICE,Royal Umbrella Thai Jasmine Rice 1Kg
RICE,Bens Original Long Grain Rice 500G
RICE,Mai Thai AAA Jasmine Fragrant Rice 5kg
RICE,Veetee Heat& Eat Thai Jasmine Rice Pots 280g
RICE,Tilda Fragrant Jasmine Rice 500g
RICE,Sainsbury's Microwave Rice Brown 250g
RICE,Tesco Tuna Chunks In Sunflower Oil 400G
RICE,Bens Original Classic Long Grain Microwave Rice 220G
RICE,Tesco Easy Cook Long Grain Rice 1Kg
RICE,Tesco Microwave Long Grain Rice 250G
RICE,Grower Harvest Long Grain Rice 1Kg
RICE,Tesco Easy Cook Rice 2Kg
RICE,Tesco Organic Easy Cook Long Grain Rice 500G
RICE,Tesco Easy Cook Long Grain Rice 4Kg
RICE,Ben's Original Classic Long Grain Microwave Rice 220g
RICE,Sainsbury's Microwave Rice Long Grain White 250g
RICE,Sainsbury's Easy Cook Long Grain White Rice 1kg
RICE,Sainsbury's Long Grain Rice 1kg
RICE,Bens Original Boil in Bag Long Grain Rice 8x62.5g
RICE,Sainsbury's Easy Cook Long Grain White Rice 2kg
RICE,Sainsbury's Easy Cook Long Grain White Rice 500g
RICE,Bens Original Long Grain Rice 1kg
RICE,Veetee Heat& Eat Long Grain Rice Pots x2 260g
RICE,Tilda Microwave Rice Premium USA Long Grain 250g
RICE,Liberty Easy Cook Long Grain Rice 5kg
RICE,Sainsbury's Long Grain Rice 2kg
