BAKA,Panini 4 Pack
MISC,Sainsbury's Clear Honey 454g
MISC,Rowse Original Squeezy Honey 250g
MISC,Rowse Natural Blossom Honey Squeezy 340g
MISC,"Sainsbury's Clear Honey, SO Organic 340g"
MISC,Rowse Set Honey 340g
MISC,Hilltop Everyday Blossom Honey 720g
MISC,Rowse Mild & Light Squeezy Honey 340g
MISC,Littleover Clear Wildflower Honey 340g
MISC,Rowse Organic Squeezy Honey 340g
MISC,Hilltop Honey Blossom Honey 340g
MISC,Rowse Clear Honey 340g
MISC,"Sainsbury's Set Honey, SO Organic 340g"
MISC,Odysea Greek Pine & Fir Tree Raw Honey 250g
MISC,Rowse Dark & Rich Honey 340g
MISC,Littleover English Set Honey 340g
MISC,"Sainsbury's Squeezy Honey, SO Organic 340g"
MISC,Sainsbury's Manuka Runny Honey 227g
MISC,Rowse Acacia Honey Squeezy 250g
MISC,"Sainsbury's Orange Blossom Honey, Taste the Difference 340g"
MISC,Clarks Organic Agave Syrup 250ml
MISC,Sainsbury's Manuka Honey 10+ 340g
MISC,Bonne Maman Black Cherry Conserve 370G
MISC,Bonne Maman Wild Blueberry Conserve 370G
MISC,Bonne Maman Strawberry  Wild Strawberry Conserve 370G
MISC,Bonne Maman Apricot Compote 380G
MISC,Bonne Maman Raspberry Conserve 370G
MISC,Tesco Finest Strawberry Conserve 340G
MISC,Bonne Maman Cherry Compote 385G
MISC,Bonne Maman Damson Plum Conserve 370G
MISC,Bonne Maman BerriesCherries Conserve 370G
MISC,Tesco Finest Blackcurran Conserve 340G
MISC,Bonne Maman Peach Conserve 370G
MISC,Bonne Maman Apricot Conserve 370G
MISC,Bonne Maman Strawberry Conserve 370G
MISC,Bonne Maman Blackcurrant Conserve 370G
MISC,Bonne Maman Intense Strawberry Jam 335G
MISC,Bonne Maman Intense Raspberry Jam 335G
MISC,Bonne Maman Intense Apricot Jam 335G
MISC,Tesco Finest Apricot Conserve 340G
MISC,Lowicz Plum Butter Jam 290G
MISC,Hartleys Best Strawberry Jam 340G
MISC,Hartleys Best Black Cherry Jam 340G
MISC,Mackays Scottish Strawberry Preserve 340G
MISC,Mackays Seedless Bramble Preserve 340G
MISC,Streamline Reduced Sugar Strawberry Jam 340G
MISC,Hubbard's Foodstore Strawberry Jam 454g
MISC,"Sainsbury's Strawberry Conserve, Taste the Difference 340g"
MISC,Sainsbury's Strawberry Jam 454g
MISC,"Sainsbury's Strawberry Conserve, Taste the Difference 340g"
MISC,Hartley's Strawberry Seedless Jam 300g
MISC,Bonne Maman Apricot Conserve 370g
MISC,"Sainsbury's Raspberry Conserve, Taste the Difference 340g"
MISC,"Sainsbury's Raspberry Jam, Seedless 454g"
MISC,Bonne Maman Raspberry Conserve 370g
MISC,Sainsbury's Apricot Jam 454g
MISC,Sainsbury's Blackcurrant Jam 454g
MISC,"Sainsbury's Blackcurrant Conserve, Taste the Difference 340g"
MISC,Sainsbury's Reduced Sugar Strawberry Jam 415g
MISC,Sainsbury's Raspberry Jam 454g
MISC,Sainsbury's Ginger Preserve 454g
MISC,Hartley's Best of Raspberry Seedless Jam 300g
MISC,St. Dalfour Strawberry Fruit Spread 284g
MISC,Bonne Maman Blackcurrant Conserve 370g
MISC,Hartley's Strawberry Jam 300g
MISC,"Sainsbury's Apricot Conserve, Taste the Difference 340g"
MISC,Sainsbury's Seedless Strawberry Jam 454g
MISC,St. Dalfour Raspberry Fruit Spread 284g
MISC,Sainsbury's Taste the Difference Chilli Jam Spicy & Sweet 200g
MISC,St. Dalfour Orange Thick Cut Fruit Spread 284g
MISC,Itsu Seaweed Thins Sea Salt 5G
MISC,Discos Salt  Vinegar Grab Bag Crisps 50G
MISC,Tyrrells Mixed Root Vegetable Crisps 40G
MISC,Walkers Baked Ready Salted 375G
MISC,Doritos Cool Original Corn Chips 48G
MISC,Propercorn Sweet  Salty 30G
MISC,Walkers Less Salt Lightly Salted Crisps 45G
MISC,Nik Naks Nice N Spicy Grab Bag Crisps 45G
MISC,Hula Hoops Big Hoops Salted Grab Bag 45G
MISC,Hula Hoops Big Hopps Salt  Vinegar Grab Bag 45G
MISC,Hula Hoops Big Hoops Salted Grab Bag 45G
MISC,Mccoys Sizzling King Prawn Grab Bag Crisps 45G
MISC,Walkers Baked Cheese  Onion 375G
MISC,Doritos Chilli Heatwave Corn Chips 48G
MISC,Mccoys Cheddar  Onion Grab Bag Crisps 45G
MISC,Doritos Tangy Cheese Corn Chips 48G
MISC,Mccoys Thai Sweet Chicken Grab Bag Crisps 45G
MISC,Mccoys Salt  Vinegar Grab Bag Crisps 45G
MISC,Big Hoops Bbq Beef Grab Bag Crisps 45G
MISC,Mccoys Flame Grilled Steak Grab Bag 45G
MISC,Pringles Pop  Go Original 40G
MISC,Walkers Less Salt Mild Cheese  Onion Crisps 45G
MISC,Wotsits Cheese 36G
MISC,Walkers Ready Salted Crisps 45G
MISC,Pringles Sour Cream  Onion 40G
MISC,Walkers Max Flamin Hot Crisps 50G
MISC,Squares Salt  Vinegar 40G
MISC,Walkers Salt  Vinegar Crisps 45G
MISC,Walkers Prawn Cocktail Crisps 45G
MISC,Walkers Max Paprika Crisps 50G
MISC,Heinz Top Down Squeezy Tomato Ketchup Sauce 700G
MISC,Tyrrells Hand Cooked Mediterranean Herb Flavour English Crisps 150g
MISC,Tyrrells Lightly Sea Salted Sharing Crisps 150g
MISC,Tyrrells Sweet Chilli & Red Pepper Sharing Crisps 150g
MISC,Pringles Sour Cream & Onion Sharing Crisps 200g
MISC,Pringles Original Sharing Crisps 200g
MISC,Doritos Cool Original Sharing Tortilla Chips Crisps 180g
MISC,"Just Snax Tortilla Chips, Basics 200g"
MISC,Doritos Chilli Heatwave Sharing Tortilla Chips Crisps 180g
MISC,Pringles Salt & Vinegar Sharing Crisps 200g
MISC,"Sainsbury's Gourmet Sea Salt Crisps, Taste the Difference 150g"
MISC,Pringles Texas BBQ Sauce Flavour Sharing Crisps 200g
MISC,Popchips Barbeque Multipack Crisps 5pk
MISC,Sensations Thai Sweet Chilli Sharing Crisps 150g
MISC,Doritos Tangy Cheese Sharing Tortilla Chips Crisps 180g
MISC,"Sainsbury's Cheddar & Spring Onion Crisps, Taste the Difference 150g"
MISC,"Sainsbury's Sea Salt & Cider Vinegar Crisps, Taste the Difference 150g"
MISC,Sainsbury's Tortilla Chips Salted 200g
MISC,Tyrrells Cider Vinegar & Salt Sharing Crisps 150g
MISC,Kettle Chips Sea Salt & Balsamic Vinegar of Modena Sharing Crisps 130g
MISC,Pringles Paprika Sharing Crisps 200g
MISC,Popchips Sour Cream & Onion Multipack Crisps 5pk
MISC,Sainsbury's Tortilla Chips Cool 200g
MISC,Sainsbury's Ready Salted Potato Sticks 150g
MISC,Tyrrells Cheddar Cheese & Chive Sharing Crisps 150g
MISC,Properchips Sea Salt Lentil Chips 85g
MISC,Jacob's Cracker Crisps Sour Cream & Chive 150g
MISC,Pringles Prawn Cocktail Flavour Sharing Crisps 200g
MISC,Kettle Chips Sea Salt & Crushed Black Peppercorns Sharing Crisps 130g
MISC,Kettle Chips Sweet Chilli & Sour Cream Sharing Crisps 130g
MISC,Pringles Cheese & Onion Sharing Crisps 200g
MISC,Sainsbury's Bacon Crispies 140g
MISC,Hellmanns Light Squeezy Mayonnaise 750Ml
MISC,Hellmanns Real Squeezy Mayonnaise 750Ml
MISC,Heinz Top Down Tomato Ketchup 910G
MISC,Heinz Top Down Squeezy Tomato Ketchup Sauce 460G
MISC,Colmans Original English Mustard 100G
MISC,Branston Piccalilli 360G
MISC,Tesco Seafood Sauce 250Ml
MISC,Tesco Finest Cranberry Sauce 220G
MISC,Baxters Baby Beetroot 567G
MISC,Tesco Whole Pickled Gherkins 680G
MISC,Colmans Mint Sauce 165G
MISC,Hp Top Down Brown Sauce 450G
MISC,Branston Small Chunk Pickle 720G
MISC,Hellmanns Real Squeezy Mayonnaise 430Ml
MISC,Branston Pickle 720G
MISC,Colmans Horseradish Sauce 136G
MISC,Colmans Seafood Sauce 155G
MISC,Colmans Bramley Apple Sauce 155G
MISC,Tesco Mango Chutney 230G
MISC,Colmans Tartare Sauce 144G
MISC,Heinz Salad Cream 425G
MISC,Tesco Finest Red Onion Chutney 230G
MISC,Tesco Pickled Red Cabbage 340G
MISC,Tesco Pitted Black Olives 330G
MISC,Branston Small Chunk Pickle 360G
MISC,Daddies Tomato Ketchup 400G
MISC,Tesco Mini Cornichons 340G
MISC,Tesco Pitted Green Olives In Brine 340G
MISC,Tesco Fire Pit Cola Ketchup 280Ml
MISC,Ocean Spray Smooth Cranberry Sauce 250G
MISC,Ocean Spray Whole Berry Cranberry Sauce 250G
MISC,Tesco Pickled Silverskin Onions 440G
MISC,Tesco Salad Cream 450Ml
MISC,Tesco Sweet Pickled Silverskin Onions 440G
MISC,Tesco Pickled Sliced Beetroot 340G
MISC,Tesco Tomato Ketchup 555G
MISC,Tesco Sweet Piccalilli 350G
MISC,Tesco Tomato Ketchup 890G
MISC,Tesco Wholegrain Mustard 180G
MISC,Tesco Mayonnaise 500Ml
MISC,Tesco Mint Sauce 185G
MISC,Tesco Traditional Pickled Onions 440G
MISC,Tesco Cranberry Sauce 200G
MISC,Tesco Dijon Mustard 185G
MISC,Tesco Bramley Apple Sauce 270G
MISC,Sharwoods Green Label Mango Chutney 530G
MISC,Kettle Sea Salt  Balsamic Vinegarcrisps40g
MISC,Tesco Tartare Sauce 175G
MISC,Heinz Tomato Ketchup Squeezy 250g
MISC,Heinz Top Down Ketchup 460g
MISC,Heinz Tomato Ketchup 910g
MISC,Heinz Tomato Ketchup 700g
MISC,Sainsbury's Tomato Ketchup Sauce 460g
MISC,Heinz Seriously Good Mayonnaise 540g
MISC,Heinz Seriously Good Light Mayonnaise 570g
MISC,Sainsbury's Balsamic Vinegar Of Modena 1 Leaf 250ml
MISC,"Sainsbury's Caesar Salad Dressing, Be Good To Yourself 250ml"
MISC,"Sainsbury's Honey & Mustard Dressing, Be Good To Yourself 250ml"
MISC,Heinz Seriously Good Mayonnaise 775g
MISC,Pizza Express House Light Salad Dressing 235ml
MISC,"Sainsbury's French Dressing, Be Good To Yourself 250ml"
MISC,Hellmann's Fat Free Vinaigrette 250ml
MISC,GOOD4U Protein Salad Topper Super Seeds 150g
MISC,Top Taste Crispy Onions 100g
MISC,Heinz Seriously Good Light Mayonnaise 815g
MISC,Cardini's Original Caesar Dressing 250ml
MISC,"Sainsbury's Balsamic Vinegar, SO Organic 250ml"
MISC,Sainsbury's Dark Soy Sauce 150ml
MISC,Sainsbury's Light Soy Sauce 150ml
MISC,Sainsbury's Soy Sauce Reduced Salt 150ml
MISC,Lea & Perrins Worcestershire Sauce 150ml
MISC,"Kikkoman Soy Sauce, Naturally Brewed 150ml"
MISC,Sainsbury's Worcester Sauce 150ml
MISC,HP Squeezy Brown Sauce 450g
MISC,Hubbard's Foodstore Brown Sauce 450g
MISC,HP Brown Sauce 255g
MISC,Daddies Brown Sauce 400g
MISC,HP The Original Brown Sauce 600g
MISC,HP Fruity Sauce 470g
MISC,Sainsbury's BBQ Sauce 500g
MISC,Nando's Peri Peri Rub Medium 25g
MISC,Heinz Classic BBQ Sauce 480g
MISC,Heinz Classic BBQ Sauce 665g
MISC,Heinz Sweet BBQ Sauce 500g
MISC,Sainsbury's Tartare Sauce 250ml
MISC,Sainsbury's Mint Sauce 250ml
MISC,Sainsbury's Bramley Apple Sauce 420ml
MISC,Colman's Tartare Sauce 144g
MISC,Sainsbury's Horseradish Sauce 160ml
MISC,Colman's Bramley Apple Sauce 155g
MISC,Sainsbury's Seafood Sauce 250ml
MISC,Colman's Mint Sauce 165g
MISC,Sainsbury's Redcurrant Jelly 250ml
MISC,Sainsbury's Dijon Mustard 185g
MISC,Colman's Original English Mustard 170g
MISC,Sainsbury's Wholegrain Mustard 180g
ANIP,Pilgrims Choice Mature Cheddar 550G
ANIP,Pilgrims Choice Extra Mature Cheddar 550G
ANIP,Tesco Finest Vintage Cheddar 300G
ANIP,Pilgrims Choice Extra Mature Cheddar 350G
ANIP,Tesco Medium Cheddar 400G
ANIP,Cathedral City Lighter Cheddar 350G
ANIP,Cathedral City Mature Cheddar 350G
ANIP,Cathedral City Extra Mature 350G
ANIP,Tesco British Mild Cheddar Cheese 400G
ANIP,Tesco Mature 10 Cheddar Slices 250G
ANIP,Cathedral City Matured Sliced 150G
ANIP,Cathedral City Extra Mature Cheddar 550G
ANIP,Cathedral City Mature Cheddar 550G
ANIP,Tesco British Medium Grated Cheddar 250G
ANIP,Tesco Mature Cheddar 400G
ANIP,Tesco 30 Reduced Fat Mature Cheese 400G
ANIP,Tesco Mild 10 Cheddar Slices 250G
ANIP,Tesco Extra Mature Cheddar Cheese 400G
ANIP,Tesco 30 Reduced Fat Extra Mature Cheese 400G
ANIP,Tesco Mature Grated Cheddar 250G
ANIP,Tesco 50 Reduced Fat Mature Grated Cheese 250G
ANIP,Tesco Extra Mature Grated Cheddar 250G
ANIP,Tesco 30 Reduced Fat Mature Cheese Slices 250G
ANIP,Creamfields Mild White Cheddar 400G
ANIP,Creamfields Mild White Cheddar 400G
ANIP,Cathedral City Mature Cheddar Cheese 350g
ANIP,Sainsbury's British Mature Cheddar Cheese 400g
ANIP,Mary Ann's Dairy Mature Cheddar Cheese 600g
ANIP,Sainsbury's British Extra Mature Cheddar Cheese 400g
ANIP,Sainsbury's British Mature Grated Cheddar Cheese 250g
ANIP,Sainsbury's British Medium Cheddar Cheese 400g
ANIP,Sainsbury's West Country Farmhouse Mature Cheddar Cheese 400g
ANIP,Mary Ann's Dairy Grated Cheddar Cheese 500g
ANIP,Sainsbury's Red Leicester Cheese 250g
ANIP,Cathedral City Extra Mature Cheddar Cheese 350g
ANIP,Sainsbury's British Mild Cheddar Cheese 400g
ANIP,"Sainsbury's Barber's Mature Cruncher Cheese, Taste the Difference 350g"
ANIP,Davidstow Cornish Extra Mature Cheddar Cheese 320g
ANIP,Sainsbury's British Mature Cheddar Cheese Slices 240g
ANIP,Cathedral City Lighter Mature Cheddar Cheese 350g
ANIP,Mary Ann's Dairy Mature Cheddar Cheese 900g
ANIP,Pilgrims Choice Extra Mature Cheddar Cheese 550g
ANIP,Cathedral City Mature Cheddar Cheese Slices x6 150g
ANIP,Sainsbury's Lighter Mature Cheese 400g
ANIP,Sainsbury's Grated Four Cheese Mix 250g
ANIP,Sainsbury's British Mature Grated Cheddar Cheese 500g
ANIP,Sainsbury's Double Gloucester Cheese 250g
ANIP,Cathedral City Grated Mature Cheddar Cheese 180g
ANIP,Cathedral City Mini Mature Cheddar Cheeses 6x20g
ANIP,Sainsbury's Lighter Mature Grated Cheese 250g
ANIP,Sainsbury's British Free Range Eggs Large x12
ANIP,Sainsbury's British Free Range Eggs Large x6
ANIP,Sainsbury's British Free Range Eggs Medium x6
ANIP,Sainsbury's British Free Range Eggs Medium x12
ANIP,Sainsbury's Free Range British Eggs Medium x15
ANIP,"Sainsbury's Woodland Free Range Large Eggs, SO Organic x6"
ANIP,Sainsbury's British Free Range Eggs Extra Large x6
ANIP,"Sainsbury's Woodland Free Range Golden Yolked Mixed Weight Eggs, Taste the Difference x6"
ANIP,"Sainsbury's Woodland Free Range Medium Eggs, SO Organic x6"
ANIP,Clarence Court Mabel Pearmans's Burford Browns Large Free Range Eggs x6
ANIP,The Happy Egg Co. Free Range Large Eggs x6
ANIP,Happy Egg Large Free Range Eggs x10
ANIP,Clarence Court Mabel Pearmans's Burford Browns Large Free Range Eggs x10
ANIP,Purely Organic Free Range Eggs x10 540g
ANIP,Clarence Court Mabel Pearmans's Burford Brown Medium Free Range Eggs x6
ANIP,The Happy Egg Co. Free Range Mixed Weight x10 497g
ANIP,Freshlay Family Run Farms Golden Yolks Free Range Eggs x10
ANIP,Two Chicks Liquid Egg White 500g
ANIP,Respectful Medium Carbon Neutral Free Range Eggs x6
ANIP,Clarence Court Old Cotswold Legbar Large Free Range Eggs x6
ANIP,Clarence Court Duck Eggs x6
ANIP,Clarence Court Brown Medium Free Range Eggs 6 Pack
ANIP,Clarence Court Burford Brown Large Free Range Eggs 6 Pack
ANIP,Rymer Farm Eggs Large Free Range 6 Eggs
ANIP,Happy Egg Co Large Free Range Eggs 6 Pack
ANIP,Tesco Finest 6 Free Range Chestnut Maran Eggs
ANIP,Happy Egg Co Free Range Eggs 10 Mixed Weight
ANIP,Tesco Mixed Sized Organic Eggs 6 Pack
ANIP,Happy Egg Co Medium Free Range Eggs 6 Pack
ANIP,Tesco Free Range Eggs Very Large 6 Pack
ANIP,St Ewes 6 Large Free Range Eggs
ANIP,StEwe Rich Yolk Free Range Eggs 6 Pack
ANIP,Tesco Large Free Range Eggs 6 Pack
ANIP,Tesco Large Free Range Eggs 12 Pack
ANIP,Big  Fresh Mixed Sized Eggs 6 Pack
ANIP,Tesco Medium Free Range Eggs 12 Pack
ANIP,Tesco Medium Free Range Eggs 6 Pack
ANIP,Two Chicks Free Range Liquid Egg White 500Ml
ANIP,Clarence Court Old Cotswold Free Range Eggs 6 Pack
ANIP,Big  Fresh Medium Eggs 6 Pack
ANIP,Tesco 10 British Mixed Weight Caged Eggs
ANIP,Tesco Mixed Sized Free Range Eggs 15 Pack
ANIP,Cravendale Semi Skimmed Milk 2 Litre
ANIP,Cravendale Pure Filtered Semi Skimmed Milk 1L
ANIP,Tesco Semi Skimmed Milk 568Ml1 Pint
ANIP,Tesco Semi Skimmed Milk 113L2 Pints
ANIP,Tesco Filtered Semi Skimmed Milk 2 Litre
ANIP,Tesco Filtered Semi Skimmed Milk 1 Litre
ANIP,Tesco British Semi Skimmed Milk 2272L 4 Pints
ANIP,Tesco Semi Skimmed Milk 3408L6 Pints
ANIP,Sainsbury's British Semi Skimmed Milk 2.27L (4 pint)
ANIP,Sainsbury's British Semi Skimmed Milk 1.13L (2 pint)
ANIP,Sainsbury's British Skimmed Milk 2.27L (4 pint)
ANIP,Cravendale Filtered Fresh Semi Skimmed Milk 2L Fresher for Longer
ANIP,Sainsbury's British Skimmed Milk 1.13L (2 pint)
ANIP,Sainsbury's British Semi Skimmed Milk 3.4L (6 pint)
ANIP,Sainsbury's British Filtered Semi Skimmed Milk 2L
ANIP,Cravendale Filtered Fresh Semi Skimmed Milk Fresher for Longer 1L
ANIP,"Sainsbury's British Semi Skimmed Milk, SO Organic 2.27L (4 pint)"
ANIP,Sainsbury's British Semi Skimmed Milk 1 Pint
ANIP,"Sainsbury's British Semi Skimmed Milk, SO Organic 1.13L (2 pint)"
ANIP,Cravendale Filtered Fresh Skimmed Milk Fresher for Longer 2L
ANIP,Violife Vegan Greek White Block 230G
ANIP,Philadelphia Original Soft Cheese 280G
ANIP,Philadelphia Light Soft Cheese 280G
ANIP,Philadelphia Garlic  Herbs Soft Cheese 280G
ANIP,Philadelphia Plant-Based Almond  Oat Soft Cheese Alternative 150G
ANIP,Tesco Finest Stratford Blue Cream Cheese 140G
ANIP,Tesco Finest Matured Lancashire Cream Cheese 140G
ANIP,Tesco Natural Cottage Cheese Fat 600G
ANIP,Tesco Pineapple 0 Fat Cottage Cheese 300G
ANIP,Tesco Fat Free Cottage Cheese 300G
ANIP,Philadelphia Original Mini Tubs 4X35g
ANIP,Philadelphia Light Mini Tub 140G 4X35g
ANIP,Primula Cheese  Prawn Tube 140G
ANIP,Primula Cheese  Ham Tube 140G
ANIP,Primula Original Cheese Tube 140G
ANIP,Philadelphia Intense Garlic  Herb Soft Cheese 140G
ANIP,Philadelphia Intense Herbes Provence Soft Cheese 140G
ANIP,Dairylea Cheese Spread 270G
ANIP,Grahams Natural Cottage Cheese Full Fat 300G
ANIP,Tesco Soft Cheese Plain Full Fat 200G
ANIP,Tesco 50 Less Fat Soft Cheese 200G
ANIP,Tesco Soft Cheese 50 Less Fat Garlic  Herb 200G
ANIP,Lactofree Soft White Cheese 200G
ANIP,Philadelphia Chives Soft Cheese 165G
ANIP,Philadelphia Original Soft Cheese 165g
ANIP,Philadelphia Light Soft Cheese 165g
ANIP,Sainsbury's White Soft Cheese 300g
ANIP,Boursin Garlic & Herb French Cheese 150g
ANIP,Sainsbury's Cottage Cheese 300g
ANIP,Sainsbury's Light Soft Cheese 250g
ANIP,"Sainsbury's Cottage Cheese, Fat Free 300g"
ANIP,Mary Ann's Dairy Soft Cheese 200g
ANIP,Philadelphia Soft Cheese Mini Tub Light x4 35g
ANIP,Philadelphia Garlic & Herbs Soft Cheese 165g
ANIP,Sainsbury's Cottage Cheese 600g
ANIP,Philadelphia Lightest Soft Cheese 165g
ANIP,Sainsbury's Fat Free Pineapple Cottage Cheese 300g
ANIP,Philadelphia Original Soft Cheese Mini Tubs 140g
ANIP,Seriously Spreadable Cheese 125g
ANIP,Boursin Garlic & Herb French Cheese Portions x6 96g
ANIP,Sainsbury's Roule Cheese 125g
ANIP,Sainsbury's Fat Free Onion & Chive Cottage Cheese 300g
ANIP,Philadelphia Original Soft Cheese 280g
ANIP,Philadelphia Chives Soft Cheese 165g
ANIP,Sainsbury's Light Garlic & Herb Soft Cheese 250g
ANIP,Seriously Spreadable Cheese Lighter 125g
ANIP,Seriously Spreadable Vintage Cheese 125g
ANIP,Castello Pineapple & Almond Cream Cheese Ring 125g
ANIP,Cravendale Filtered Whole Milk 2 Litre
ANIP,Arla Big Milk 2Ltr
ANIP,Yeo Valley Organic Whole Milk 2 Litre
ANIP,Tesco Organic Free Range Whole Milk 1136L 2 Pint
ANIP,Cravendale Whole Milk 1 Litre
ANIP,Tesco Organic Whole Milk 2272L4 Pints
ANIP,Tesco Whole Milk 568Ml1 Pint
ANIP,Tesco Whole Milk 2 Pints113L
ANIP,Grahams Gold Smooth Milk 1 Litre
ANIP,Tesco Finest Jersey Whole Milk 1L
ANIP,Tesco Filtered Whole Milk 2 Litre
ANIP,Tesco Whole Milk 2272L4 Pints
ANIP,Tesco Salmon Side 1Kg
ANIP,Sainsbury's British Whole Milk 2.27L (4 pint)
ANIP,Sainsbury's British Whole Milk 1.13L (2 pint)
ANIP,Sainsbury's British Whole Milk 3.4L (6 pint)
ANIP,"Sainsbury's British Whole Milk, SO Organic 2.27L (4 Pint)"
ANIP,Cravendale Filtered Fresh Whole Milk 2L Fresher for Longer
ANIP,Sainsbury's British Whole Milk 568ml (1 pint)
ANIP,Yeo Valley Organic Fresh Whole Milk 2L
ANIP,"Graham's Whole Milk, Organic 1L"
ANIP,Tesco Organic 2 Boneless Salmon Fillets 265G
ANIP,Tesco Finest 2 Scottish Loch Trout Fillets 260G
ANIP,Leap Wild Smoked Sockeye Salmon 100G
ANIP,Tesco Hot Smoked Roasted Salmon Fillets 180G
ANIP,Tesco Finest Scottish Salmon Fillets 240G
ANIP,Tesco Boneless Haddock Fillets 280G
ANIP,Sainsbury's Skin on ASC Scottish Salmon Fillets x2 240g
ANIP,Harbour Smokehouse Salmon 100g
ANIP,Sainsbury's ASC Scottish Mild Smoked Salmon 100g (Ready to Eat)
ANIP,Sainsbury's Skin on ASC Scottish Salmon Fillets x4 480g
ANIP,Mowi Scottish Salmon Fillets 230g
ANIP,Sainsbury's ASC Scottish Mild Smoked Salmon 200g (Ready to Eat)
ANIP,"Sainsbury's ASC Oak Smoked Scottish Salmon, Taste the Difference 100g (Ready to eat)"
ANIP,Sainsbury's Scottish Smoked Salmon Trimmings 100g (Ready to Eat)
ANIP,"Sainsbury's Skinless ASC Scottish Salmon Fillets, Taste the Difference x2 240g"
ANIP,Mowi Smoked Scottish Salmon Slices x4 100g
ANIP,"Sainsbury's Skinless ASC lightly Smoked Scottish Salmon Fillets, Taste the Difference x2 240g"
ANIP,"Sainsbury's Loch Trout Fillets, Taste the Difference x2 240g"
ANIP,Sainsbury's Skin on ASC Scottish Salmon Fillet 600g
ANIP,Sainsbury's Skin on ASC Scottish Salmon Fillet Tails 140g
ANIP,"Sainsbury's Skin on ASC Scottish Salmon Fillets, So Organic x2 240g"
ANIP,Sainsbury's Honey Roast ASC Scottish Salmon Portions x2 180g (Ready to eat)
ANIP,"Sainsbury's ASC Scottish Smoked Salmon, So Organic 100g (Ready to Eat)"
ANIP,"Sainsburys Hebridean Kiln Dried Thick Sliced ASC Scottish Smoked Salmon, Taste the Difference 100g (Ready to Eat)"
ANIP,Wild Fish Discovery Keta Salmon x2 230g
ANIP,Tesco 2 Lemon  Pepper Sea Bass Fillets 200G
ANIP,Tesco 2 Boneless Sea Bass Fillets 180G
ANIP,Tesco 4 Boneless Sea Bass Fillets 360G
ANIP,Tesco Boneless Smoked Haddock 280G
ANIP,Tesco 2 Cape Hake Fillets 240G
ANIP,Tesco 2 Skinless  Boneless Basa Fillets 250G
ANIP,Tesco 2 Boneless Cod Fillets 280G
ANIP,Tesco Finest Skinless  Boneless Cod Loins 280G
ANIP,Tesco Finest Skinless  Boneless Cod Loins 280G
ANIP,Tesco Finest Raw Jumbo King Prawns 165G
ANIP,Fish Said Fred Big Cod Fillets x2 320g
ANIP,Fish Said Fred Glorious Whole Sea Bream x2 520g
ANIP,Sainsbury's Sea Bass Fillets ASC 180g
ANIP,Sainsbury's Skinless & Boneless Smoked Haddock Fillets 240g
ANIP,"Sainsbury's Cod Fillets, Boneless & Skinless 250g"
ANIP,Fish Said Fred Big Sea Bass Fillets 240g
ANIP,Sainsbury’s Smoked Basa fillets ASC 240g
ANIP,Sainsbury's Basa Fillets ASC 250g
ANIP,Sainsbury's Skinless & Boneless Haddock Fillets 260g
ANIP,Sainsbury’s Sea Bass Fillets ASC x4 360g
ANIP,"Sainsbury's Smoked Cod Fillets, Boneless & Skinless 230g"
ANIP,Sainsbury's Butterflied Sea Bass 255g
ANIP,Tesco Raw King Prawns 165G
ANIP,Tesco Lemon  Garlic King Prawns 150G
ANIP,Tesco Chilli  Lime King Prawns 150G
ANIP,Tesco Cold Water Prawns 150G
ANIP,Tesco Finest Canadian Cooked Prawns 150G
ANIP,Seachill Cooked Peeled King Prawns 150G
ANIP,Tesco Finest Raw Argentinian Red Shrimp 180G
ANIP,Tesco Finest Pil Pil King Prawns 220G
ANIP,Tesco Cooked  Peeled King Prawns 150G
ANIP,Tesco Organic Cooked  Peeled Black Tiger Prawns 150G
ANIP,Tesco Finest Unsmoked Dry Cure Streaky
ANIP,Tesco Finest Smoked Dry Cure Streaky Bacon
ANIP,Sainsbury's Large King Prawns ASC 150g
ANIP,Fisherman King Prawns 140g
ANIP,Sainsbury's Peeled Coldwater Prawns MSC 150g
ANIP,"Sainsbury's Canadian Peeled Coldwater Prawns, Taste the Difference MSC 150g"
ANIP,"Sainsbury's Large King Prawns ASC, Taste the Difference 150g"
ANIP,"Sainsbury's Coldwater Prawn Cocktail, Be Good to Yourself MSC 170g"
ANIP,Sainsbury's Large King Prawns ASC 300g
ANIP,Sainsbury's Raw King Prawns ASC 165g
ANIP,Sainsbury's King Prawns ASC in Garlic & Parsley ASC 150g
ANIP,"Sainsbury's Large Raw Peeled King Prawns ASC, Taste the Difference 165g"
ANIP,"Sainsbury's King Prawns ASC, So Organic 150g"
ANIP,"Sainsbury's Large Black Tiger Prawns ASC, Taste the Difference 150g"
ANIP,"Sainsbury's Jumbo King Prawn ASC Crevettes, Taste the Difference 200g"
ANIP,Tesco Unsmoked Streaky Bacon 300G
ANIP,Tesco Smoked Streaky Bacon 300G
ANIP,Woodside Farms Streaky Bacon 275G
ANIP,Tesco Reduced Fat  Salt 10 Unsmoked Bacon Medallions 300G
ANIP,Tesco Reduced Fat  Salt 10 Smoked Bacon Medallions 300G
ANIP,Tesco Unsmoked Twin Pack Back Bacon 2X360g
ANIP,Tesco Smoked Twin Pack Back Bacon 2X360g
ANIP,Tesco Smoked Lardons 200G
ANIP,Tesco Unsmoked Lardons 200G
ANIP,Tesco Finest Unsmoked Wiltshire Cured Bacon 240G
ANIP,Tesco Finest Smoked Wiltshire Cured Bacon 240G
ANIP,Tesco Bacon Strips 50G
ANIP,Tesco Finest Unsmoked Dry Cure Streaky
ANIP,Tesco Finest Smoked Dry Cure Streaky Bacon
ANIP,Mattessons Smoked Turkey Rashers 200G
ANIP,Tesco Unsmoked Streaky Bacon 300G
ANIP,T Unsmkd Thick Cut Back Bacon Rasher 300G
ANIP,Tesco Unsmked Back Bacon10 300G Promo
ANIP,Tesco Smoked Streaky Bacon 300G
ANIP,Tesco Pork Loin Joint
ANIP,Tesco Large Pork Shoulder Joint
ANIP,Sainsbury's Thick Unsmoked Back Bacon Rashers x6 300g
ANIP,Sainsbury's Thick Smoked Cut Back Bacon Rashers x6 300g
ANIP,Sainsbury’s Smoked Back British Bacon Rashers x10  300g
ANIP,"Sainsbury's Smoked Streaky British Bacon, Taste the Difference x14 220g"
ANIP,Sainsbury’s Unsmoked Back British Bacon Rashers x10 300g
ANIP,Sainsbury's Reduced Salt Smoked Back Bacon x8 250g
ANIP,Sainsbury's Reduced Salt Unsmoked Back Bacon x8 250g
ANIP,"Sainsbury's Unsmoked Streaky British Bacon, Taste the Difference X14 220g"
ANIP,"Sainsbury's Oak Smoked Dry Cure British Bacon, Taste the Difference x 6 220g"
ANIP,"Sainsbury's Unsmoked Dry Cure British Bacon, Taste the Difference x 6 220g"
ANIP,Sainsbury's 16 Smoked Back Bacon Rashers 2x250g
ANIP,J James & Family Smoked Back Bacon Rashers 300g
ANIP,Sainsbury's Smoked Streaky Bacon Rashers 300g
ANIP,"Sainsbury's Unsmoked Bacon Medallions, Be Good To Yourself x8 200g"
ANIP,"Sainsbury's Smoked Bacon Medallions, Be Good To Yourself x8 200g"
ANIP,Sainsbury's Unsmoked Back Bacon Rashers x16 (2x250g)
ANIP,"Sainsbury's Wiltshire Cured Unsmoked British Back Bacon, Taste the Difference x8 240g"
ANIP,Sainsbury's Unsmoked Streaky Bacon Rashers 300g
ANIP,"Sainsbury's Oak Smoked British Bacon Lardons, Taste the Difference 160g"
ANIP,Finnebrogue Naked Unsmoked Back Bacon x6 200g
ANIP,Sainsbury's Smoked Bacon Lardons 250g
ANIP,Woodside Farms Pork Loin Steaks 720G
ANIP,Tesco 4 Pork Chops 900G
ANIP,Tesco 4 Pork Loin Steaks 540G
ANIP,Tesco Finest Pork Loin Steaks 400G
ANIP,Tesco Pork Loin Steaks 2 Pack 270G
ANIP,Tesco Fresh Diced Pork Topside 500G
ANIP,Tesco Finest Pork Chops 500G
ANIP,Tesco Sweet Bbq Pulled Pork 410G
ANIP,Tesco Pork Leg Joint 1Kg
ANIP,Tesco Gammon Steak With Cheese  Pineapple 345G
ANIP,Tesco Small Unsmoked Gammon Joint
ANIP,Tesco Fire Pit 4 Pork Mozzarella  Tomato Kebabs 400G
ANIP,Tesco Whole Milk 3408L6 Pints
ANIP,Tesco Fire Pit 6 Bbq Maple Pork Loin Steaks 600G
ANIP,Tesco Pork Stir Fry 500G
ANIP,Tesco 2 Pork Loin Chops 450G
ANIP,Tesco Firepit 6 Chinese Style Pork Loin Steaks 600G
ANIP,Woodside Farms Pork Chops 700G
ANIP,Tesco Pork Loin Steaks 960G
ANIP,Tesco Pork Shoulder Steaks 700G
ANIP,Tesco Fin  Korean Inspired Butterfield Pork Shoulder Joint 670G
ANIP,Tesco Small Smoked Gammon Joint
ANIP,Tesco Finest Slow Cooked Char Siu Pork Shoulder 560G
ANIP,Tesco Large Beef Roasting Joint With Basting Fat
ANIP,Sainsbury's British Pork Mince 5% Fat 500g
