BAKA,Panini 4 Pack
BAKA,Tesco Chunky Cheese Rolls 4 Pack
BAKA,Ciabatta Roll 4 Pack
BAKA,St Pierre 6 Brioche Burger Buns
BAKA,Tesco Large White Hot Dog Rolls 6 Pack
BAKA,Big Bite Soft White Roll 6Pack
BAKA,6 Pack White Finger Rolls
BAKA,6 Pack Soft White Rolls
BAKA,Large White Bap 4 Pack
BAKA,Baker Street Burger Buns 6 Pack
BAKA,Baker Street 4 Hot Dog Rolls
BAKA,Tesco Finest 4 Mango  Passion Fruit Buttermilk Pancakes
BAKA,Warburtons Sliced Sandwich Rolls 12 Pack
BAKA,Tesco Finest 4 Onion Brioche Hot Dog Rolls
BAKA,Tesco Finest 4 Brioche Burger Buns
BAKA,Tesco Wholemeal Deli Rolls 4 Pack
BAKA,Warburtons Hot Dog Rolls X 6
BAKA,Tesco Fire Pit 6 Jumbo Brioche Hot Dog Rolls
BAKA,Tesco 4 Brioche Buns
BAKA,Tesco Finest 2 Turmeric Brioche Burger Buns
BAKA,Warburtons 6 Sliced Sandwich Rolls
BAKA,Tesco Large Wholemeal Baps 4 Pack
BAKA,Tesco 4 Large White Baps
BAKA,Tesco Large Seeded Burger Buns 4 Pack
BAKA,Tesco Finest 6 Mini Brioche Buns
BAKA,Tesco Wholemeal Batch Rolls 6 Pack
BAKA,Tesco White Batch Rolls 6 Pack
BAKA,Bfree Demi Baguette 2 Pack 220G
BAKA,"New York Bakery Co. Bagels, Plain x5"
BAKA,New York Bakery Co. Onion & Chive Bagels x5
BAKA,Paul Hollywood Ready to Bake Multi-Seed Rolls x4
BAKA,"New York Bakery Co. Bagels, Plain x5"
BAKA,"New York Bakery Co. Bagels, Cinnamon & Raisin x5"
BAKA,St. Pierre Brioche Burger Buns x6
BAKA,Warburtons 4 Seeded Protein Thin Bagels
BAKA,Daily's White Rolls x4 300g
BAKA,Sainsbury's Mini Ciabatta Roll
BAKA,Warburtons Sliced White Rolls x12
BAKA,Daily's Wholemeal Rolls x4 300g
BAKA,Warburtons Gluten Free Super Soft Sliced Square Rolls x4 240g
BAKA,Sainsbury's Stonebaked Ciabatta Rolls x4
BAKA,Schar Gluten Free Brown Ciabatta Rolls x4
BAKA,"Sainsbury's Artisan Seeded Sourdough Pave, Taste the Difference 400g"
BAKA,Sainsbury's Super Seed Grain Large Rolls Taste the Difference x4
BAKA,Warburtons 6 Soft Sliced White Rolls
BAKA,Plant Pioneers Brioche Style Burger Buns x2 140g
BAKA,"New York Bakery Co. Bagels, Wholemeal x5"
BAKA,Schar Gluten Free White Ciabatta Rolls x4
BAKA,Sheldons Brown Oven Bottom Muffins x4
BAKA,Warburtons 6 Soft Sliced Wholemeal Rolls
BAKA,Genius White Rolls 280g
BAKA,Sainsbury's Super Seed Grain Rolls Taste the Difference x6
BAKA,Sainsbury's Plain Bagel x5
BAKA,Bfree Tiger Rolls 4x60g
BAKA,St Pierre Burger Buns x4
BAKA,Genius Ciabatta Rolls x2
BAKA,Mr Kipling Manor House Cake Each
BAKA,Tesco Finest Free From Carrot Cake
BAKA,Mr Kipling Lemon Loaf Cake  Crumble 210G
BAKA,Tesco Free From Lemon Loaf Cake
BAKA,Tesco Angel Layer Cake Each
BAKA,Tesco Banana Loaf Cake
BAKA,Tesco Lemon Loaf Cake
BAKA,Tesco Coconut  Raspberry Loaf Cake
BAKA,Soreen Sliced Malt Loaf 290G
BAKA,Norfolk Cake Co Mixed Fruit Loaf Cake
BAKA,Tesco Raspberry Sponge Cake Each
BAKA,Tesco Coconut Sponge Cake Each
BAKA,Tesco Iced Coffee Cake
BAKA,Tesco Genoa Cake Each
BAKA,Tesco Lemon Iced Madeira Cake Each
BAKA,Tesco Strawberry Jam Victoria Sponge 360G
BAKA,Tesco Strawberry  Cream Swiss Roll
BAKA,Soreen Original Malt Loaf 260G
BAKA,Tesco Madeira Cake
BAKA,Tesco Lemon Swiss Roll
BAKA,Tesco Walnut Cake
BAKA,Soreen Banana Loaf 260G
BAKA,Tesco Iced Madeira Cake Each
BAKA,Tesco Chocolate Brownie Bar Cake
BAKA,Mcvities Jamaica Ginger Cake Each
BAKA,Mcvities Original Lyles Golden Syrup Cake
BAKA,Tesco Finest Chocolate Cake
BAKA,Tesco Double Chocolate Swiss Roll
BAKA,Tesco Chocolate Mega Loaf
BAKA,Tesco Finest Lemon Drizzle Cake Each
BAKA,Tesco Finest Coffee  Walnut Cake Each
BAKA,Ms Mollys Raspberry Swiss Roll
BAKA,"Sainsbury's Victoria Sponge Cake, Taste the Difference 345g (Serves 6)"
BAKA,"Sainsbury's Colombian Coffee Cake, Taste the Difference 400g (Serves 6)"
BAKA,Sainsbury's Cherry Bakewells x6 240g
BAKA,"Sainsbury's Chocolate Cake, Taste The Difference 395g (Serves 6)"
BAKA,"Sainsbury's Carrot Cake, Taste the Difference 395g (Serves 6)"
BAKA,"Sainsbury's Lemon Cake, Taste the Difference 405g"
BAKA,Sainsbury's Jaffa Cakes x24 282g
BAKA,Real Lancashire Eccles Cakes x4
BAKA,Sainsbury's Fresh Custard Slices x2 180g
BAKA,Sainsbury's Cherry Madeira Cake (Serves 8)
BAKA,Sainsbury's Walnut Cake (Serves 8)
BAKA,Sainsbury's Lemon Iced Madeira Cake (Serves 8)
BAKA,Sainsbury's Strawberry Jam & Cream Victoria Sponge 340g
BAKA,Mr Kipling Manor House Cake 390g (Serves 6)
BAKA,Sainsbury's Madeira Cake 275g (Serves 8)
BAKA,Sainsbury's Angel Cake 250g
BAKA,Bfree Sweet Potato Gluten Free Wrap 6X42g
BAKA,Warburtons Gluten Free White Wraps 4 Pack
BAKA,Old El Paso 6 Regular Gluten Free Tortilla 216G
BAKA,Old El Paso 8 Tortilla Pockets 223G
BAKA,Capsicana 6 Large Tortilla Wheat Flour Wraps 390G
BAKA,Old El Paso Stand N Stuff Soft Flour Tortillas 8Pk 193G
BAKA,Capsicana 8 Mini Tortilla Wheat Flour Wraps 240G
BAKA,Old El Paso Large Super Soft Flour Tortillas 6 Pack 350G
BAKA,Weight Watchers Wraps 6 Pack
BAKA,Deli Kitchen 4 Sliced Focaccia 360G
BAKA,Crosta  Mollica 6 Durum Wheat Piadina Midi Flatbreads 240G
BAKA,Crosta  Mollica 6 Whole Blend Piadina Midi Flatbreads 240G
BAKA,Deli Kitchen 4 Greek Style Flatbreads 320G
BAKA,Mission Deli 6 Wheat  White Mini Wraps
BAKA,Old El Paso Super Soft Flour Tortillas Whole Wheat 8Pk 326G
BAKA,Mission Deli Mini Wrap Original 6 Pack
BAKA,Old El Paso Regular Super Soft Flour Tortillas 8Pk 326G
BAKA,Mission Deli Wheat  White Wraps 6 Pack 367G
BAKA,Mission Deli Original Wraps Super Soft 6 Pack 367G
BAKA,Tesco 8 Mini White Tortilla Wraps
BAKA,Old El Paso Corn Tortillas 335G
BAKA,Deli Kitchen 6 Brioche Style Tortilla Wraps 366G
BAKA,Tesco Folded Flatbreads Plain 6 Pack
BAKA,Tesco Malted Grain  Rye Folded Flatbread 6 Pack
BAKA,Tesco 8 Plain Tortilla Wraps
BAKA,Tesco 8 Wholemeal Tortilla Wraps
BAKA,Deli Kitchen 6 Carb Lite Wraps 300G
BAKA,HW Nevills 8 Plain Tortilla Wraps
BAKA,HW Nevills 8 Wholemeal Tortilla Wrap
BAKA,Crosta & Mollica Piadina Golden Durum Wheat Italian Flatbreads Wraps x4 300g
BAKA,Old El Paso Large Soft Flour Tortilla Wraps x6 350g
BAKA,Crosta & Mollica Piadina Organic Wholeblend Italian Flatbreads Wraps x4 300g
BAKA,Old El Paso Regular Soft Flour Tortilla Wraps x8 326g
BAKA,Deli Kitchen Carb Lite Wraps x6 300g
BAKA,Mission Deli Mini Plain Tortillas x6
BAKA,Mission Deli Wrap Wheat & White x6
BAKA,Sainsbury's Mini Tortilla Wraps x8
BAKA,Friend Birthday Card Pink with Cute Character and Sentiment Greeting Card
BAKA,Old El Paso Regular Soft Whole Wheat Tortilla Wraps x8 326g
BAKA,Sainsbury's Plain Tortilla Wraps x8
BAKA,Warburtons Gluten Free White Wraps x4
BAKA,Sainsbury's Wholemeal Tortilla Wraps x8
BAKA,Sainsbury's Non Stick Baking Sheets x20
BAKA,Mission Deli Wrap Plain x6
BAKA,BFree Sweet Potato Wraps x6
BAKA,Mission Deli Mini Wraps x6 186g
BAKA,Old El Paso Regular Soft Flour Tortilla Wraps x12 489g
BAKA,Old El Paso Mexican Tortilla Wrap Pockets x8 223g
BAKA,Sainsbury's Plain Flour Tortillas x8 320g
BAKA,Sainsbury's Wholemeal Tortilla Wraps x8 512g
BAKA,Sainsbury's Plain Tortilla Wraps x8 496g
BAKA,Tesco Crusty White Farmhouse Loaf Sliced 800G
BAKA,Tiger Loaf Sliced 800G
BAKA,Crusty White Sandwich Loaf Sliced 800G
BAKA,Tiger Loaf Sliced 400G
BAKA,Warburtons Sliced Tiger Bread 600G
BAKA,Warburtons Farmhouse White Bread 800G
BAKA,Warburtons Old English White Bread 400G
BAKA,Kingsmill Soft White Medium Bread 800G
BAKA,Hovis Soft White Medium Bread 800G
BAKA,Hovis Soft White Thick Bread 800G
BAKA,Warburtons Toastie Sliced White Bread 800G
BAKA,Warburtons Medium Sliced White Bread 800G
BAKA,Tesco Finest White Loaf With Sourdough 800G
BAKA,Tesco White Farmhouse 800G
BAKA,Tesco Toastie White Bread Thick 800G
BAKA,Tesco White Bread 800G
BAKA,H W Nevills White Bread 800G
BAKA,White Farmhouse 800G
BAKA,Tiger Bloomer 800G
BAKA,Crusty White Sandwich Loaf 800G
BAKA,Tiger Bloomer 400G
BAKA,Crusty White Farmhouse Loaf 400G
BAKA,Crusty White Split Tin 800G
BAKA,Crusty White Bloomer 800G
BAKA,Petit Pain 4 Pack
BAKA,Crusty White Bloomer 400G
BAKA,Warburtons Milk Roll Soft Medium Sliced White Bread 400g
BAKA,Hovis Soft Medium Sliced White Bread 800g
BAKA,Black Sheep Craft White Bloomer 800g
BAKA,Black Sheep Craft Tiger Bloomer 800g
BAKA,Schar White Wholesome Loaf 300g
BAKA,Jason's Sourdough White Ciabattin 580g
BAKA,Hovis Soft Thick Sliced White Bread 800g
BAKA,Kingsmill Soft White Bread Thick 800g
BAKA,Warburtons Premium Old English White Bread 400g
BAKA,Warburtons Extra Thick Sliced White Bread 800g
BAKA,"Sainsbury's White Sourdough Bloomer Thick Sliced, Taste the Difference 800g"
BAKA,Sainsbury's Free From White Sliced Loaf 535g
BAKA,Warburtons Soft Farmhouse Thick Sliced White Bread 800g
BAKA,Hovis Farmhouse 800g
BAKA,Kingsmill No Crusts Soft Medium Sliced White Bread 400g
BAKA,Warburtons White Batch Bloomer 800g
BAKA,"Sainsbury's Multiseed Loaf, Taste the Difference 800g"
BAKA,Sainsbury's Wholemeal Bread SO Organic 400g
BAKA,"Sainsbury's Sourdough Pave, Taste the Difference 400g"
BAKA,Sainsbury's Giraffe Bread (Tiger) 800g
BAKA,Sainsbury's Kalamata Olive Bread Taste the Difference 400g
BAKA,Sainsbury's Giraffe Bread (Tiger) 400g
BAKA,Sainsbury's Multiseed Loaf Taste the Difference 400g
BAKA,Sainsbury's Farmhouse Loaf White Bread 800g
BAKA,Sainsbury's San Francisco Style Sourdough Taste the Difference 400g
BAKA,Sainsbury's Sandwich Loaf White Bread 800g
BAKA,Sainsbury's White Bread SO Organic 400g
BAKA,"Sainsbury's Pain De Campagne, Taste the Difference 400g"
BAKA,"Sainsbury's Hand-Crafted Sourdough Bloomer, Taste The Difference 400g"
BAKA,Sainsbury's White Bloomer 400g
BAKA,Sainsbury's White Bloomer 800g
BAKA,"Sainsbury's Stonebaked White Baton, Taste the Difference"
BAKA,Tesco Hi Fibre Wholemeal Loaf 800G
BAKA,Tesco Hi Fibre Malted Loaf 800G
BAKA,Tesco Hi Fibre Malted Loaf 800G Sliced
BAKA,Tesco Hi Fibre Wholemeal Loaf 800G Sliced
BAKA,Tesco Hi Fibre Wholemeal Loaf 400G
BAKA,Tesco Hi Fibre Wholemeal Loaf 400G Sliced
BAKA,Tesco Hi Fibre Malted Loaf 400G
BAKA,Tesco Hi Fibre Malted Loaf 400G Sliced
BAKA,Hovis Granary Wholemeal Bread 800G
BAKA,Hovis Wholemeal Thick Bread 800G
BAKA,Hovis Wholemeal Medium Bread 800G
BAKA,Kingsmill Tasty Wholemeal Medium Bread 800G
BAKA,Warburtons Wholemeal Medium Bread 800G
BAKA,Tesco Finest Wholemeal Loaf 800G
BAKA,Tesco Wholemeal Medium Bread 800G
BAKA,Tesco Toastie Wholemeal Thick Bread 800G
BAKA,H W Nevills Wholemeal Bread 800G
BAKA,Sainsbury's Medium Sliced Wholemeal Bread 800g
BAKA,"Sainsbury's Soft Multiseed Farmhouse Thick Sliced Wholemeal Bread, Taste the Difference 800g"
BAKA,Warburtons Medium Sliced Wholemeal Bread 400g
BAKA,Hovis Medium Sliced Wholemeal Bread 800g
BAKA,Warburtons Medium Sliced Wholemeal Bread 800g
BAKA,Hovis Nimble Medium Sliced Wholemeal Bread 400g
BAKA,Hovis Thick Sliced Wholemeal Bread 800g
BAKA,Sainsbury's Thick Sliced Wholemeal Bread 800g
BAKA,Allinson The Champion Medium Sliced Wholemeal Bread 650g
BAKA,Daily's Medium Sliced Wholemeal Bread 800g
BAKA,"Sainsbury's Soft Multiseed Wholemeal, Taste the Difference 430g"
BAKA,Hovis Medium Sliced Wheatgerm Bread 400g
BAKA,Warburtons Danish Lighter Wholemeal Bread 400g
BAKA,Sainsbury's Wholemeal Bread Medium 400g
BAKA,Kingsmill No Crusts Medium Sliced Wholemeal Bread 400g
BAKA,Warburtons Wholemeal Thick Bread 400g
BAKA,Schar Gluten Free Wholesome Seeded Loaf 300g
BAKA,Warburtons Speciality Multi Grain and Seed Bread 400g
BAKA,Hovis Granary Cob 450g
BAKA,Warburtons Big 21 Seeds 700g
BAKA,Warburtons Plant Power 700g
BAKA,Vogel Seeded Wholemeal Bread 800g
BAKA,Hi-Lo Seeded Medium Sliced Wholemeal Bread 400g
BAKA,Promise Gluten Free Chia and Quinoa Loaf 480g
BAKA,Mcdougalls Self Raising Flour 11Kg
BAKA,Homepride Self Raising Flour 1Kg
BAKA,Doves Farm Gluten Free Self Raising 1Kg
BAKA,Tesco Organic Self Raising Flour 1Kg
BAKA,Tesco Self Raising Flour 15Kg
BAKA,Stockwell  Co Self Raising Flour 15Kg
BAKA,Allinson Wholemeal Self Raising Flour 1Kg
BAKA,Matthews Flour Organic Super Fine Self Raising Flour 15Kg
BAKA,Sainsbury's Self Raising Flour 1.5kg
BAKA,"Homepride Extra Fine Self Raising Flour, Stay Fresh Pack 1kg"
BAKA,Sainsbury's Self Raising Flour 500g
BAKA,Freee Gluten Free Self Raising White Flour 1kg
BAKA,McDougalls Self Raising Flour 1.1kg
BAKA,McDougalls Speciality Supreme Sponge Self Raising Flour 1kg
BAKA,Allinson Wholemeal Self Raising Flour 1kg
BAKA,Sainsbury's Cream of Tartar 160g
BAKA,Doves Farm Organic White Self Raising Flour 1kg
BAKA,Doves Farm Organic Self Raising Wholemeal Flour 1kg
BAKA,Elephant Atta Medium Chapatti Flour 10Kg
BAKA,Tesco Finest Abbv Very Strong Bread Flour 1Kg
BAKA,Tesco Medium Chapatti Flour 5Kg
BAKA,Tesco Wholemeal Chapatti Flour 10Kg
BAKA,Tesco Focaccia Bread Mix 500G 500G
BAKA,Tesco Ciabatta Bread Mix 500G 500G
BAKA,Tesco Oat  Linseed Bread Mix 500G
BAKA,Tesco Plain Flour 15Kg
BAKA,Stockwell  Co Plain Flour 15Kg
BAKA,Doves Farm Organic Oat Flour 450G
BAKA,Doves Farm Organic Wholemeal 1Kg Buckwheat Flour
BAKA,Doves Farm Organic Malthouse Flour Bread 1Kg
BAKA,Doves Farm Organic White Spelt Flour 1Kg
BAKA,Matthews Flour Eight Grain Strong Multigrain 15Kg
BAKA,Doves Farm Organic Rye Flour 1Kg
BAKA,Doves Farm Organic White Rye Flour 1Kg
BAKA,Matthews Flour Stone Ground Dark Rye Flour 15Kg
BAKA,Matthews Flour Premium White Strong Flour 15Kg
BAKA,Allinsons Garlic  Herb Naan Bread Kit 237G
BAKA,Matthews Cotswold Strong Crunch Flour 15Kg
BAKA,Homepride Premium Milled Extra Fine Flour 1Kg
BAKA,Matthews Flour Organic Plain Fine Flour 15Kg
BAKA,Matthews Flour Organic Super Fine Self Raising Flour 15Kg
BAKA,Tesco Cornflour 500G
BAKA,Doves Farm Organic Spelt Wholemeal Flour 1Kg
BAKA,Doves Farm Organic Brown Rice Flour 290G
BAKA,Elephant Atta Chapatti Flour Wholemeal 10Kg
BAKA,Brown  Polson Cornflour 500G
BAKA,Allinson Wholemeal Plain Flour 1Kg
BAKA,Mcdougalls Plain Flour 11Kg
BAKA,Matthews Flour Stoneground Strong Wholegrain 15Kg
BAKA,Sainsbury's Plain Flour 1.5kg
BAKA,Sainsbury's Strong White Unbleached Bread Flour 1.5kg
BAKA,Sainsbury's Plain Flour 500g
BAKA,Sainsbury's Strong White Unbleached Bread Flour 1.5kg
BAKA,Sainsbury's Strong Stoneground 100% Wholemeal Flour 1.5kg
BAKA,"Homepride Extra Fine Plain Flour, Stay Fresh Pack 1kg"
BAKA,"Sainsbury's Wholegrain Seeded Flour, Taste the Difference 1kg"
BAKA,Allinson Country Grain Bread Flour 1kg
BAKA,Freee Gluten Free Plain White Flour 1kg
BAKA,Doves Farm Organic Strong White Flour 1.5kg
BAKA,Allinson White Strong Bread Flour 3kg
BAKA,McDougalls Plain Flour 1.1kg
BAKA,Doves Farm Organic White Flour 1kg
BAKA,Doves Farm Organic Wholemeal Spelt Flour 1kg
BAKA,McDougalls Instant Thickening Granules 170g
BAKA,Carrs Breadmaker Strong White Flour 1.5kg
BAKA,Sainsbury's Strong Brown Flour 1.5kg
BAKA,"Sainsbury's Very Strong Canadian Bread Flour, Taste the Difference 1kg"
BAKA,Groovy Food Company Coconut Sugar Organic 500G
BAKA,Tesco Dark Brown Soft Sugar 1Kg Bag
BAKA,Tesco Light Brown Soft Sugar 1Kg Pack
BAKA,Silver Spoon Caster Sugar 1Kg
BAKA,Silver Spoon Jam Sugar 1Kg
BAKA,Pure Via Sugar Free Demerara Alternative 200G
BAKA,Pure Via Bakers Secret Icing Sugar Alternative 220G
BAKA,Billingtons Demerara Sugar 1Kg
BAKA,Silver Spoon Icing Sugar 1Kg
BAKA,Tesco Golden Caster 1Kg Bag
BAKA,Billingtons Molasses Sugar 500G
BAKA,Tesco Demerara Sugar 1Kg
BAKA,Tesco Golden Granulated Sugar 1Kg
BAKA,Billingtons Demerara Sugar 500G
BAKA,Billingtons Demerara Rough Cut Cubes 500G
BAKA,Billingtons Golden Granulated Sugar 1Kg
BAKA,Billingtons Light Brown Sugar 500G
BAKA,Billingtons Dark Muscovado 500G
BAKA,Billingtons Light Muscovado 500G
BAKA,Canderel Caster Sugar  Sweetener Blend 370G
BAKA,Silver Spoon Granulated Sugar 5Kg
BAKA,Trade Aid Uk Pure Cane Caster Sugar 1Kg
BAKA,Silver Spoon Royal Icing Sugar 500G
BAKA,Billingtons Golden Caster 1Kg
BAKA,Sainsbury's White Granulated Sugar 1kg
BAKA,Sainsbury's Fairtrade White Granulated Sugar 1kg
BAKA,Sainsbury's White Granulated Sugar 500g
BAKA,Sainsbury's White Granulated Sugar 5kg
BAKA,Sainsbury's Fairtrade Golden Granulated Sugar 1kg
BAKA,Tate & Lyle Fairtrade Cane Sugar White Cubes 500g
BAKA,Billington's Golden Granulated Sugar 1kg
BAKA,Silver Spoon Half Spoon Granulated Sugar 1kg
BAKA,Silver Spoon Half Spoon Granulated Sugar 500g
BAKA,"Sainsbury's Fairtrade Cane Sugar, SO Organic 500g"
BAKA,The Groovy Food Company Organic Coconut Sugar 500g
BAKA,Sainsbury's White Caster Sugar 1kg
BAKA,Sainsbury's Fairtrade Golden Caster Sugar 1kg
BAKA,Sainsbury's White Caster Sugar 500g
BAKA,Sainsbury's Fairtrade White Caster Sugar 1kg
BAKA,"Billington's Natural Golden Caster, Unrefined Cane Sugar 1kg"
BAKA,Billington's Golden Caster Natural Unrefined Cane Sugar 250g
BAKA,Truvia Caster for Baking 360g
BAKA,Sainsbury's Fairtrade Light Soft Brown Sugar 500g
BAKA,Sainsbury's Fairtrade Demerara Cane Sugar 1kg
BAKA,Sainsbury's Fairtrade Demerara Cane Sugar 500g
BAKA,Sainsbury's Fairtrade Golden Granulated Sugar 1kg
BAKA,Sainsbury's Fairtrade Dark Soft Brown Sugar 500g
BAKA,Sainsbury's Fairtrade Demerara Cane Sugar 2kg
BAKA,Sainsbury's Fairtrade Light Brown Soft Sugar 1kg
BAKA,Billington's Golden Granulated Sugar 1kg
BAKA,Billington's Light Muscovado Sugar 500g
BAKA,Billington's Demerara Sugar 500g
BAKA,Sainsbury's Fairtrade Dark Soft Brown Sugar 1kg
BAKA,Billington's Demerara Natural Unrefined Cane Sugar 250g
BAKA,Billington's Dark Muscovado Sugar 500g
BAKA,Billington's Light Brown Soft Natural Unrefined Cane Sugar 500g
MISC,Lindt Lindor Milk Chocolate Truffles Carton 200G
MISC,Ferrero Rocher 24 Pieces Boxed Chocolates 300G
MISC,Cadbury Dairy Milk Chocolate Bar 360G
MISC,Lindt Excellence Dark 70 Cocoa Chocolate Bar 100G
MISC,Ferrero Rocher 16 Pieces Boxed Chocolates 200G
MISC,Maltesers Gift Box Chocolates 310G
MISC,Celebrations Chocolates 300G
MISC,Cadbury Delights Nougat Salted Caramel Chocolate 5X22g
MISC,Cadbury Delights Soft Nougat Hazelnut 5X22g
MISC,Cadbury Delights Soft Nougat Orange  Caramel 5X22g
MISC,Tesco Classic 74 Dark Chocolate 100G
MISC,Nestle Kit Kat Chunky Milk Chocolate Bars Multipack 4 X 40g
MISC,Smarties Chocolate Multipack 4 X 34G
MISC,Maltesers Milk Chocolate Box 110G
MISC,Cadbury Flake Chocolate Bars Multipack 4 X 255g
MISC,Cadbury Dairy Milk Giant Buttons Chocolate Bag 119G
MISC,Cadbury Twirl Chocolate Bars Multipack 4 X 34g
MISC,Cadbury Dairy Milk For Kids 6 Pack 108G
MISC,Cadbury Dairy Milk Caramel Chocolate Bars Multipack 4 X 37g
MISC,Tesco Dark Chocolate Bar 200G
MISC,Tesco Milk Chocolate Raisins 200G
MISC,Tesco Milk Chocolate Peanut 200G
MISC,Tesco Milk Chocolate Bar 200G
MISC,Tesco Crunchy Caramel Chocolate Bars Multipack 5 X 42g
MISC,Tesco Dreamy Caramel Chocolate Bars Multipack 6 X 40g
MISC,Tesco Nutty Nougat Caramel Chocolate Bars Multipack 6 X 40g
MISC,Ms Mollys Dark Chocolate Bar 100G
MISC,Lindt Lindor Assorted Chocolate Truffles 200G
MISC,Cadbury Dairy Milk Chocolate Bar 110g
MISC,Lindt Excellence Dark 70% Cocoa Chocolate Bar 100g
MISC,Cadbury Dairy Milk Chocolate Bar 180g
MISC,Cadbury Dairy Milk Fruit & Nut Chocolate Bar 110g
MISC,Lovett's Dark Chocolate 100g
MISC,Cadbury Dairy Milk Whole Nut Chocolate Bar 120g
MISC,Lindt Excellence Dark Sea Salt Chocolate Bar 100g
MISC,Sainsbury's Dark Chocolate 200g
MISC,Lindt Excellence Dark 90% Cocoa Chocolate Bar 100g
MISC,Lovett's Milk Chocolate 100g
MISC,Lindt Excellence Dark Mint Chocolate Bar 100g
MISC,Lindt Excellence Dark Caramel and Sea Salt Chocolate Bar 100g
MISC,Lindt Excellence Dark Orange Chocolate Bar 100g
MISC,Green & Black's Organic 85% Dark Chocolate Bar 90g
MISC,Lindt Excellence Dark 85% Cocoa Chocolate Bar 100g
MISC,Green & Black's Organic 70% Dark Chocolate Bar 90g
MISC,Lindt Excellence Milk Extra Creamy Chocolate Bar 100g
MISC,Sainsbury's Milk Chocolate 200g
MISC,Sainsbury's Mint Humbugs 200g
MISC,Sainsbury's Butter Mintoes 200g
MISC,Sainsbury's Mint Imperials 200g
MISC,Trebor Extra Strong Peppermint Mints 4x41.3g
MISC,Sainsbury's Mint Assortment 200g
MISC,Polo Original Mints Roll Multipack 4x34g
MISC,Polo Sugar Free Mints Roll Multipack 4x33.4g
MISC,Extra Spearmint Sugarfree Chewing Gum Bottle Pieces x60
MISC,Trebor Softmints Spearmint Mints 4x44.9g
MISC,Extra Peppermint Chewing Gum Sugar Free Multipack 6x10 Pieces
MISC,Extra White Bubblemint Chewing Gum Sugar Free Bottle 46 Pieces
MISC,Walkers Mint Toffees Bag 150g
MISC,Tic Tac Fresh Mint 100 48g
MISC,Extra Peppermint Chewing Gum Sugar Free Large Bottle 90 Pieces
MISC,XXX Extra Strong Peppermints Multipack 5x40.5g
MISC,Extra Cool Breeze Chewing Gum Sugar Free Multipack 6x10 Pieces
MISC,Extra Spearmint Chewing Gum Sugar Free Multipack 6x10 Pieces
MISC,Fox's Glacier Mints 200g
MISC,Airwaves Menthol & Eucalyptus Sugar Free Chewing Gum Bottle 46 Pieces
MISC,Airwaves Menthol & Eucalyptus Chewing Gum Sugar Free Multipack 6x10 Pieces
MISC,Polo Original Mints Roll 34g
MISC,Extra White Bubblemint Chewing Gum Sugar Free Multipack 6x10 Pieces
MISC,Tic Tac Fresh Strong Mint 16.4g
MISC,Polo Spearmint Mints 4x34g
MISC,Extra Ice Peppermint Chewing Gum Sugar Free Bottle 46pcs
MISC,Mentos Chewy Dragees Mint Rolls 5x38g
MISC,Extra White Chewing Gum Sugar Free Bottle 46pcs
MISC,Mentos Fruit Chewy Dragees Rolls 5x38g
MISC,Extra Cool Breeze Chewing Gum Sugar Free Bottle 60pcs
MISC,Trebor Extra Strong Mints 48g
MISC,Extra Ice Peppermint Chewing Gum Sugar Free Multipack 6x10 Pieces
MISC,Mentos Pure Fresh Freshmint Sugar Free Chewing Gum x50 100g
MISC,Extra Refreshers Tropical Flavour Sugarfree Chewing Gum Bottle 30 Pieces
MISC,Extra Strawberry Flavour Sugarfree Chewing Gum Bottle Pieces x60
MISC,Mentos Gum Pure Fresh Freshmint Bottle 50Pc 100G
MISC,Mentos Gum Spearmint 50Pc Btl100g
MISC,Mentos Gum Pure Fresh Bubblefresh 50Pc 97G
MISC,Wrigleys Extra Spearmint Bottle 60 Piece
MISC,Wrigleys Extra Peppermint Gum Bottle 60 Pieces
MISC,Wrigleys Extra Sugar Free Strawberry Gum 60 Pieces 84G
MISC,Wrigleys Extra Refreshers Tropical Chewing Gum 67G
MISC,Wrigleys Extra Refreshers Bubble Mint 30S Gum 67G
MISC,Extra Coolbreeze 60 Piece Bottle 84G
MISC,Wrigleys Extra Spearmint 6X10 Pieces 84G
MISC,Wrigleys Extra Peppermint 6X10 Pieces 84G
MISC,Wrigleys Extra White Bubblemint 6X10 Pieces 84G
MISC,Wrigleys Extra Ice Peppermint 6X10 Pieces 84G
MISC,Wrigleys Extra Cool Breeze 6X10 Pieces 84G
MISC,Wrigleys Airwaves Menthol Eucalyptus 6X10pcs 84G
MISC,Wrigley Extra Bubblemint Gum Bottle 46 Pieces
MISC,Airwaves Menthol  Eucalyptus Gum Bottle 46 Pieces
MISC,Extra White Gum Bottle 46 Pieces64g
MISC,Wrigleys Extra Tropical Chewing Gum Sugar Free 156G
MISC,Wrigleys Extra Sugar Free Apple Flavour Gum 14G
MISC,Wrigleys Extra Sugar Free Blueberry Gum 10 Pieces 14G
MISC,Wrigleys Extra Refreshers Gum Bubblemint 7Pce
MISC,Wrigleys Extra Refreshers Gum Peppermint 7 Pieces
MISC,Wrigleys Hubba Bubba Triple Tape
MISC,Airwaves Blackcurrant Gum 10 Pieces
MISC,Extra Strawberry Gum 10 Pieces
MISC,Extra Spearmint Gum 10 Pieces
MISC,Extra White Peppermint Gum 10 Pieces
MISC,Extra Peppermint Gum 10 Pieces
MISC,Airwaves Menthol  Eucalyptus Gum 10 Pieces
MISC,Extra Ice Peppermint Gum 10 Pieces
MISC,Extra White Bubblemint Gum 10 Pieces
MISC,Extra Cool Breeze Gum 10 Pieces
MISC,Nerds Candy Rainbow Fruit Flavour 1417G
MISC,Maynards Bassetts Wine Gums 350G
MISC,Maynards Bassetts Jelly Babies 350G
MISC,Haribo Maoam Joystixx 140G R
MISC,Squashies Drumsticks 160 G
MISC,Bassetts Jelly Babies 190G
MISC,Bassetts Liquorice Allsorts 190G
MISC,The Natural Confectionery Company Jelly Snakes 130G
MISC,Haribo Maoam Pinballs 140G R
MISC,Haribo Maoam Stripes 140G R
MISC,Tesco Fruit Jellies 200G
MISC,Nerds Candy Watermelon  Cherry 467G
MISC,Nerdsd Candy Grape  Strawberry 467G
MISC,Rowntrees Vegan Fruit Pastilles 4X428G
MISC,Maoam 8 Pack Bloxx Chewy Sweets 176G
MISC,Squashies Drumstick Sour Cherry  Apple 160G
MISC,Tesco Fizzy Strawberry Flavour Lances 75G
MISC,Tesco Fizzy Cola Lances 75G
MISC,Haribo Fruitilicious Fruit Gums 150G
MISC,Haribo Giant Strawbs Fruit Gums 175G
MISC,Rowntrees Pic And Mix Vegan Friendly Sweets 150G
MISC,Rowntrees Vegan Strawberry  Blackcurrant Fruit Pastilles 143G
MISC,Haribo Jelly Babies Double Trouble 175G
MISC,Tesco Mini Jelly Beans 85G
MISC,Hilltop Premium Manuka 100 Mgo Honey Of New Zealand 225G
MISC,Sainsbury's Strawberry Laces Sweets 70g
MISC,Rowntree's Fruit Gums Sweets Sharing Pouches 150g
MISC,Rowntree’s Fruit Pastilles Sweets Tube Multipack 4x42.8g
MISC,Maoam Joystixx Chewy Sweets Bag 140g
MISC,Haribo Giant Strawbs Vegetarian Sweets Bag 175g
MISC,Sainsbury's Jelly Babies Sweets 225g
MISC,Haribo Starmix Mini Bag Multipack Sweets 22x16g
MISC,Sainsbury's Mint Humbugs 200g
MISC,Haribo Tangfastics Sour Sweets Bag 175g
MISC,Haribo Starmix Sweets Bag 175g
MISC,Sainsbury's Butter Mintoes 200g
MISC,Sainsbury's Mint Imperials 200g
MISC,Werther's Original Butter Sweets 135g
MISC,Sainsbury's Fruit Jellies Sweets 225g
MISC,Rowntree’s Fruit Pastilles Sweets Sharing Pouch 143g
MISC,Maynards Bassetts Jelly Babies Sweets Bag 190g
MISC,Swizzels Drumstick Squashies Sweets 160g
MISC,The Natural Confectionery Co. Jelly Snakes Sweets Bag 160g
MISC,Haribo Supermix Sweets Bag 175g
MISC,Maynards Bassetts Wine Gums Sweets Bag 190g
MISC,Sainsbury's Wine Gums Sweets 225g
MISC,Sainsbury's Marshmallows 200g
MISC,Sainsbury's Mint Assortment 200g
MISC,Werther's Original Sugar Free Sweets 80g
MISC,Hilltop Manuka 350Mgo New Zealand Honey 225G
MISC,Rowse Cut Comb In Acacia Honey 340G
MISC,Hilltop Premium Manuka Honey 500 Mgo 225G
MISC,Tesco Finest Grade A Amber Maple Syrup 330G
MISC,Rowse Supahoney Manuka  Honey 250G
MISC,Buckwud Organic Maple Syrup 250G
MISC,Tesco Finest Grade A Dark Maple Syrup 330G
MISC,Pasieka Multiflower Honey 1Kg
MISC,Rowse Organic Squeezy Honey 680G
MISC,Tesco Finest Eucalyptus Honey 340G
MISC,Rowse Squeezy Greek Honey 250G
MISC,Hilltop Everyday Blossom Honey 680G
MISC,Rowse Squeezy Organic Honey 340G
MISC,Rowse Organic Clear 340G
MISC,Rowse Honey Squeezy 680G
MISC,Tesco Organic Squeezy Clear Honey 340G
MISC,Wrigleys Extra White 6X10 Pieces 84G
MISC,Rowse Set Honey 340G
MISC,Tesco Organic Pure Set Honey 340G
MISC,Tesco Finest Acacia Honey 340G
MISC,Rowse Squeezy Light  Mild Honey 340G
MISC,Hilltop Everyday Blossom Honey 720G
MISC,Rowse Squeezy Clear Honey 340G
MISC,Rowse Squeezy Honey Dark  Rich 340G
MISC,Hubbard's Clear Honey 340g
MISC,Sainsbury's Set Honey 454g
MISC,Rowse Original Squeezy Honey 680g
