BAKA,Panini 4 Pack
ANIP,Sainsbury's British Pork Loin Steaks x4 480g
ANIP,Sainsbury's Small Unsmoked British Gammon Joint 750g
ANIP,Sainsbury's British Pork Belly Slices 500g
ANIP,Sainsbury's British Pork Loin Medallions x4 400g
ANIP,Sainsbury's Just Cook British Gammon Joint with Sweet Honey Glaze (Serves 3)
ANIP,Sainsbury's British Pork Loin Steaks x8 800g
ANIP,Sainsbury's Butcher's Choice British Pork Sausagemeat 400g
ANIP,Sainsbury’s Chinese Style British Pork Loin Steaks 440g
ANIP,Sainsbury's Small Smoked British Gammon Joint 750g
ANIP,Sainsbury's Extra Lean British Pork Stir Fry 300g
ANIP,J.James & Family Unsmoked British Gammon Steak 200g
ANIP,Sainsbury's British Pork Chops x2 350g
ANIP,Sainsbury's British Pork Loin Steaks x2 240g
ANIP,Sainsbury's Unsmoked Rindless British Gammon Steaks x2 400g
ANIP,Sainsbury's Butcher's Choice British Pork & British Bacon Pigs In Blankets x12 260g
ANIP,Sainsbury's Thick Cut British Pork Chops x2 500g
ANIP,Deli Express Thick Cut British Roast Gammon Slices x4 150g
ANIP,Sainsbury's Slow Cooked British Pork Ribs Smokey BBQ Sauce 646g (Serves 2)
ANIP,Sainsbury's British Pork Shoulder Steaks x4 600g
ANIP,Tesco Finest Beef Roasting Joint
ANIP,Tesco Medium Beef Roasting Joint With Basting Fat
ANIP,Tesco Finest Diced Beef 400G
ANIP,Tesco Finest 5 Aberdeen Angus Steak Mince 500G
ANIP,Tesco 12 Beef Meatballs 336G
ANIP,Tesco Lean Diced Beef 600G
ANIP,Tesco Finest 20 Mini Meatballs 336G
ANIP,Tesco Finest 12 Beef  Herb Meatballs 336G
ANIP,Tesco Finest Aberdeen Angus Steak Mince 500G
ANIP,Tesco Finest 4 British Beef Steak Burgers 454G
ANIP,Tesco Beef Rump Steak 255G
ANIP,Tesco Finest Sirloin Steak 227G
ANIP,Tesco 24 Beef Meatballs 672G
ANIP,Tesco Lean Diced Beef 400G
ANIP,Tesco Diced Beef 400G
ANIP,Seachill Cooked Peeled Cold Water Prawns 150G
ANIP,Fresh Beef Brisket Slow- Roast
ANIP,Tesco 2 Beef Medallion Steaks 340G
ANIP,Tesco Finest Fillet Steak 210G
ANIP,Tesco Finest Ribeye Steak 227G
ANIP,Tesco 4 Quarter Pound Burgers 454G
ANIP,Tesco Lean Beef Steak Mince 5 Fat 250G
ANIP,Tesco Stewing Steak 400G
ANIP,Tesco Room To Roam British Chicken Breast Fillets 650G
ANIP,Sainsbury's British or Irish 5% Fat Beef Mince 500g
ANIP,Sainsbury's British or Irish 5% Fat Beef Mince 750g
ANIP,Sainsbury's British or Irish 20% Fat Beef Mince 500g
ANIP,Sainsbury's British or Irish 5% Fat Beef Mince 250g
ANIP,Sainsbury's British or Irish Extra Lean Diced Beef 500g
ANIP,"Sainsbury's British Beef Mince 5% Fat , Taste the Difference 500g"
ANIP,Sainsbury's British or Irish 10% Fat 12 Beef Meatballs 350g
ANIP,Sainsbury's British or Irish Extra Lean Diced Beef 250g
ANIP,"Sainsbury's Beef Mince 12% Fat , Taste the Difference 500g"
ANIP,Sainsbury's British or Irish 12% Fat Beef Mince 500g
ANIP,Sainsbury's Organic British Beef Mince 5% Fat 500g
ANIP,"Sainsbury's Beef Meatballs, Taste the Difference 350g"
ANIP,Sainsbury's British Beef Mince 1kg
ANIP,Sainsbury's British or Irish 5% Fat 12 Beef Meatballs 350g
ANIP,Sainsbury's British or Irish Extra Lean Casserole Steak 500g
ANIP,Sainsbury's 5% Fat Beef Mince 500g
ANIP,Sainsbury's British or Irish 10% Fat 24 Meatballs 700g
ANIP,Sainsbury's British or Irish 10% Fat 20 Beef Mini Meatballs 350g
ANIP,Sainsbury's British or Irish Diced Beef 500g
ANIP,Sainsbury's Organic British Beef Mince 12% Fat 500g
ANIP,Sainsbury's Beef Meatballs 500g
ANIP,Sainsbury's 12% Fat Beef Mince 800g
ANIP,"Sainsbury's British Diced Beef, SO Organic 500g"
ANIP,Tesco British Diced Chicken Breast 650G
ANIP,Tesco Mini Chicken Fillets 650G
ANIP,Tesco British Diced Chicken Breast 400G
ANIP,Tesco Room To Roam British Chicken Breast Portions 300G
ANIP,Tesco British Chicken Breast Mini Fillets 400G
ANIP,Tesco Fresh Chicken Livers 380G
ANIP,Tesco 2 British Chicken Breast Fillets 300G
ANIP,Tesco Finest 2 Cornfed Free Range Chicken Fillets 270G-470G
ANIP,Tesco British Chicken Breast Portions 950G
ANIP,Willow Farm Chicken Breast Portions 900G -12Kg
ANIP,Tesco Large Chicken Fillet Pack 16Kg
ANIP,Tesco 4 British Turkey Burgers 454G
ANIP,Tesco British Turkey Thigh Joint 125Kg
ANIP,Tesco Mini Turkey Breast Fillets 400G
ANIP,Sainsbury's British Fresh Chicken Breast Fillets Skinless & Boneless 1kg
ANIP,Sainsbury's British Fresh Chicken Breast Fillets Skinless & Boneless 640g
ANIP,Sainsbury's British Fresh Chicken Breast Fillets Skinless & Boneless 300g
ANIP,Sainsbury's British Fresh Chicken Breast Mini Fillets 320g
ANIP,Sainsbury's Cooked Roast British Chicken Breast Fillets x2 240g
ANIP,Sainsbury's British Fresh Diced Chicken Breast 410g
ANIP,Sainsbury's Fresh British Chicken Breast Fillet garlic Kyiv x2 390g
ANIP,Sainsbury's Just Cook Chicken Breast Joint Butter Basted 500g (Serves 3)
ANIP,Sainsbury's British Fresh Chicken Breast Mini Fillets 640g
ANIP,Sainsbury's Cajun Spiced British Fresh Chicken Breast Grills x2 330g
ANIP,Sainsburys Southern fried Fresh British Chicken breast fillet x2 315g
ANIP,Sainsbury's British Fresh Diced Chicken Breasts 750g
ANIP,Tesco British Turkey Breast Mince 2 Fat 500G
ANIP,Tesco 12 British Turkey Meatballs 336G
ANIP,Tesco British Turkey Drumsticks
ANIP,Tesco 4 Cheese  Jalapeno Turkey Burgers 454G
ANIP,Tesco British Turkey Breast Steaks 380G
ANIP,Tesco Butter Basted Turkey Breast Joint 640G
ANIP,Tesco Turkey Thigh Mince 7 Fat 500G
ANIP,Tesco Beef Fillet Steak 170G
ANIP,Tesco British Chicken Breast Portions 650G
ANIP,Sainsbury's 2% Fat Fresh British Turkey Mince 500g
ANIP,Sainsbury's Quick Cook Fresh British Turkey Steaks x4 400g
ANIP,Sainsbury's 7% Fat Fresh British Turkey Mince 500g
ANIP,Sainsbury's Fresh British Turkey Meatballs x12 400g
ANIP,Sainsbury's Fresh British Turkey Gluten Free Sausages x8 454g
ANIP,Sainsbury's Fresh British Turkey Breast Mini Fillets 400g
ANIP,Sainsbury's 7% Fat Fresh British Turkey Mince 750g
ANIP,Sainsbury's 2% Fresh British Turkey Mince 250g
ANIP,Sainsbury's Fresh British Turkey Breast Fillet Portions 250g
ANIP,Sainsbury's Fresh British Turkey Burgers x4 454g
ANIP,Oakpark Smoked Turkey Rashers x6 150g
ANIP,Sainsbury's Fresh British Turkey Breast Steaks 600g
ANIP,Sainsbury's Caramelisd Onion Fresh British Turkey Gluten Free Sausages x8 454g
ANIP,Bernard Matthews Turkey Chunks 80g
ANIP,Humza Turkey & Beef Halal Sliced Cured 80g
ANIP,Humza Turkey Halal Salchichon 65g
FRTV,TRipe  Ready Twin Pack Avocados
FRTV,Tesco Ripe  Ready Avocado
FRTV,Tesco Ripen At Home Avocados 3Pack
FRTV,TReady To Eat Large Avocados Each
FRTV,Tesco Smashed Avocado With Chilli - 200G
FRTV,By Sainsbury’s Medium Ripe & Ready Avocado
FRTV,Sainsbury’s Medium Ripe & Ready Avocados x2
FRTV,By Sainsbury’s Large Ripe & Ready Avocado
FRTV,Sainsbury’s Baby Ripen at Home Avocados x4
FRTV,By Sainsbury’s 4 Small Ripe & Ready Avocados
FRTV,SO Organic Medium Ripe & Ready Avocados x2
FRTV,Bananas Loose
FRTV,Tesco Organic Fair Trade Bananas 5 Pack
FRTV,Sainsbury's Fairtrade Bananas Loose
FRTV,Sainsbury's Fairtrade Bananas x5
FRTV,Tesco Blueberries 350G
FRTV,Tesco Blueberries 150G
FRTV,Tesco Blueberries 250G
FRTV,Tesco Blueberries 500G
FRTV,Tesco Finest Blueberries 150G Class 1
FRTV,Tesco Organic Blueberries 150G
FRTV,Sainsbury's Blueberries 300g
FRTV,Sainsbury's Blueberries 150g
FRTV,Sainsbury's Blueberries 500g
FRTV,Rosedene Farms Gala Apples 6 Pack
FRTV,Large Pink Lady Apples Class 1 Loose
FRTV,Tesco Pink Lady Apple Minimum 5 Pack
FRTV,Large Braeburn Apples Loose Class 1
FRTV,Tesco Large Gala Apples Class 1 Loose
FRTV,Rosedene Farms Small Apple 6 Pack
FRTV,Tesco Gala Apple Minimum 5 Pack
FRTV,Tesco Braeburn Apple Minimum 5 Pack
FRTV,Tesco British Apple Minimum 5 Pack
FRTV,Tesco Granny Smith Apple Minimum 5 Pack
FRTV,Tesco Jazz Apple
FRTV,Large Granny Smith Apples Class 1 Loose
FRTV,Tesco Golden Delicious Apple Minimum 5
FRTV,Rosedene Farms Braeburn Apples 6 Pack
FRTV,Tesco Organic Gala Apples 630G
FRTV,Sainsbury's Royal Gala Apples x6
FRTV,Sainsbury's SO Organic Apples x6
FRTV,Sainsbury's Braeburn Apples x6
FRTV,Sainsbury's Pink Lady Apples x6
FRTV,Sainsbury's Pink Lady Apples x4
FRTV,Sainsbury's Granny Smith Apples x6
FRTV,Sainsbury's Jazz Apples x6
FRTV,Sainsbury's British Bramley Cooking Apples Loose
FRTV,"Sainsbury's Royal Gala Apples, SO Organic x6"
FRTV,Sainsbury's Cox Apples
FRTV,Sainsbury's Braeburn Apple Single
FRTV,Imperfectly Tasty Gala Apples x6
FRTV,Sainsbury's Pink Lady Apple Single
FRTV,Sainsbury's Golden Delicious Apples x6
FRTV,Sainsbury's Mini Apples x6
FRTV,Sainsbury's Best Of British Apples x6
FRTV,Sainsbury's Kanzi Apples x6
FRTV,Sainsbury's Apples 1kg
FRTV,Tesco Red Seedless Grapes Punnet 500G
FRTV,Tesco Green Seedless Grapes Punnet 500G
FRTV,Tesco Seedless Grape Selection Pack 500G
FRTV,Suntrail Farms Grapes 500G
FRTV,Tesco Black Seedless Grapes 500G
FRTV,Tesco Finest Red Grapes Seedless 400G
FRTV,Tesco Finest Green Grapes Seedless 400G
FRTV,Tesco Finest Black Grapes Seedless 400G
FRTV,Suntrail Farms Green Grapes 500G
FRTV,Tesco Large Selection Grapes 800G Pack
FRTV,Tesco Grapes 110G
FRTV,"Sainsbury's Black Sable Seedless Grapes, Taste the Difference 400g"
FRTV,Sainsbury's Red Seedless Grapes 500g
FRTV,Sainsbury's White Seedless Grapes 500g
FRTV,Sainsbury's Red & White Seedless Grapes 500g
FRTV,Sainsbury's Mixed Grapes 900g
FRTV,Sainsbury's Black Seedless Grapes 500g
FRTV,Imperfectly Tasty Grapes 500g
FRTV,Sainsbury's Red Grapes 300g
FRTV,Sainsbury's White Grapes 300g
FRTV,"Sainsbury's Vitoria Grape, Taste the Difference 400g"
FRTV,Large Kiwi Fruit Class 1 Each
FRTV,Tesco Perfectly Ripe Kiwi
FRTV,Suntrail Farms Kiwi X6
FRTV,Tesco Perfectly Ripe Gold Kiwi 4 Pack
FRTV,Sainsbury's Kiwi Fruit x6
FRTV,Sainsbury's Ripe & Ready Kiwi x4
FRTV,Sainsbury's Large Kiwi Fruit Single
FRTV,"So Kiwi, Organic x4"
FRTV,Tesco Lemons 4 Pack
FRTV,Tesco Organic Unwaxed Lemons Minimum 3 Pack
FRTV,Sainsbury's Lemons
FRTV,Sainsbury's Lemons Unwaxed minimum 5
FRTV,Imperfectly Tasty Lemons x5
FRTV,"Sainsbury's Lemons Unwaxed, SO Organic x3"
FRTV,Tesco Orange Minimum 5 Pack
FRTV,Jaffa Oranges Minimum 4 Pack
FRTV,Tesco Finest Emperor Oranges 4 Pack
FRTV,Suntrail Farms Orange Minimum 5 Pack
FRTV,"Sainsbury's Oranges, Taste the Difference x4"
FRTV,Sainsbury's Tangerines 600g
FRTV,Sainsbury's Oranges Large x4
FRTV,Sainsbury's Oranges x5
FRTV,Sainsbury's Oranges
FRTV,Imperfectly Tasty Oranges x5
FRTV,Sainsbury's Satsumas 600g
FRTV,Tesco Pineapple Chunks 300G
FRTV,Tesco Pineapple Chunks 145G
FRTV,Tesco Pineapple 500G
FRTV,Tesco Pineapple Chunks 450G
FRTV,Sainsbury's Pineapple
FRTV,Sainsbury's Large Pineapple
FRTV,Sainsbury’s Pineapple 500g
FRTV,Tesco Plums 400G
FRTV,Suntrail Farms Plum 1Kg
FRTV,Sainsbury's Plum Punnet 400g
FRTV,Sainsbury's Ripe & Ready Plums x5
FRTV,Tesco Raspberries 150G
FRTV,Rosedene Farms Raspberries 125G
FRTV,Tesco Finest Raspberries 150G
FRTV,Tesco Raspberries 425G
FRTV,Tesco Raspberries 350G
FRTV,Sainsbury's Raspberries 250g
FRTV,Sainsbury's Raspberries 150g
FRTV,"Sainsbury's Raspberries, Taste the Difference 150g"
FRTV,Tesco Broccoli 375G
FRTV,Broccoli Loose
FRTV,Tesco Tenderstem Broccoli 200G
FRTV,Tesco Large Broccoli Pack 500G
FRTV,Tesco Purple Sprouting Broccoli 200G
FRTV,Tesco Tenderstem Broccoli Tips 120G
FRTV,Tesco Tenderstem Broccoli Spears 330G
FRTV,Tesco Organic Tenderstem Broccoli 200G
FRTV,Tesco Organic Broccoli 335G
FRTV,Tesco Broccoli Florets 900G
FRTV,Tesco Trimmed Tenderstem Broccoli 80G
FRTV,Sainsbury's Broccoli Loose
FRTV,Sainsbury's Tenderstem Broccoli 200g
FRTV,"Sainsbury's Broccoli, SO Organic 300g"
FRTV,Sainsbury's Broccoli Florets 900g
FRTV,Sainsbury's Purple Sprouting Broccoli Spears 200g
FRTV,"Sainsbury's Tenderstem Broccoli, SO Organic 200g"
FRTV,"Sainsbury's Bellaverde Broccoli, Taste the Difference 200g"
FRTV,Sainsbury's Tenderstem Broccoli 330g
FRTV,SO Organic Broccoli 500g
FRTV,Tesco Carrots Loose
FRTV,Tesco Carrots 800G
FRTV,Tesco Carrot Batons 400G
FRTV,Organic Carrots 700G
FRTV,Tesco Chantenay Carrots 500G
FRTV,Tesco Sliced Carrots Peeled  Cut 1Kg
FRTV,Tesco Mini Carrots 320G
FRTV,Tesco Imperator Carrot 450G
FRTV,Tesco Chantenay Carrots 600G
FRTV,Tesco Tendersweet Carrots 150G
FRTV,Tesco Organic Bunched Carrots 400G
FRTV,Tesco Grated Carrot 200G
FRTV,Sainsbury's Carrots 1kg
FRTV,Sainsbury’s Carrots Loose
FRTV,"Sainsbury's Carrots, So Organic 700g"
FRTV,Sainsbury's Greengrocer Carrots
FRTV,Sainsbury's Carrots 500g
FRTV,Sainsbury's British Chantenay Carrots 400g
FRTV,Sainsbury's Carrot Batons 400g
FRTV,Sainsbury's Ready Prepared Mini Carrots 240g
FRTV,"Sainsbury's British Sweet Spear Carrots, Taste the Difference 450g"
FRTV,"Sainsbury's Bunched Carrots, SO Organic 400g"
FRTV,Tesco Cauliflower
FRTV,Cauliflower Extra Large Each
FRTV,Tesco Cauliflower Florets 900G
FRTV,Tesco Cauliflower Florets 240G
FRTV,Sainsbury's Cauliflower
FRTV,Imperfectly Tasty Cauliflower
FRTV,Sainsbury's Broccoli & Cauliflower Florets 240g
FRTV,Sainsbury's Cauliflower & Broccoli Floret Mix 1kg
FRTV,"Sainsbury's Cauliflower, SO Organic"
FRTV,Sainsbury's Baby Cauliflowers x2
FRTV,Tesco Cucumber Whole Each
FRTV,Tesco Whole Large Cucumber
FRTV,Tesco Baby Cucumbers 200G
FRTV,Tesco Organic Whole Cucumber Each
FRTV,Sainsbury's Whole Cucumber
FRTV,"Sainsbury's Whole Cucumber, SO Organic"
FRTV,Sainsbury's Half Cucumber Portion
FRTV,Sainsbury's Large Whole  Cucumber
FRTV,Sainsbury's Baby Cucumbers 200g
FRTV,Sainsbury's Iceberg Lettuce
FRTV,Sainsbury's Little Gem Lettuce x2
FRTV,Sainsbury's Sweet Gem Lettuce x2
FRTV,"Sainsbury's Romaine Lettuce Hearts, Twin Pack x2"
FRTV,Sainsbury's Iceberg Lettuce 200g
FRTV,"Sainsbury's Cos Lettuce, Mini Red x2"
FRTV,Sainsbury's Lambs Lettuce 60g
FRTV,"Sainsbury's Lettuce, Round"
FRTV,Sainsbury's Chinese Leaf Lettuce
FRTV,"Sainsbury's Little Gem Lettuce, SO Organic x2"
FRTV,"Sainsbury's Cos Lettuce, SO Organic"
FRTV,Tesco Little Gem Lettuce 2 Pack
FRTV,Iceberg Lettuce Each
FRTV,Tesco Iceberg Lettuce 200G
FRTV,Tesco Butterhead Lettuce
FRTV,Tesco Sweet Gem Lettuce
FRTV,Tesco Romaine Lettuce Hearts 2 Pack
FRTV,Tesco Organic Lettuce Each
FRTV,Tesco Shredded Iceberg 130G
FRTV,Sainsbury's Closed Cup White Mushrooms 300g
FRTV,Sainsbury's Large Flat White Mushrooms 250g
FRTV,Sainsbury's Baby Button Mushrooms 200g
FRTV,Sainsbury's Chestnut Super Mushrooms 300g
FRTV,Sainsbury's Closed Cup White Mushrooms 500g
FRTV,Sainsbury's Closed Cup Chestnut Mushrooms 300g
FRTV,Sainsbury's Closed Cup White Mushrooms Loose
FRTV,"So Chestnut Mushrooms, Organic 300g"
FRTV,"Sainsbury's Mushrooms, Sliced 250g"
FRTV,"Sainsbury's Shiitake Mushrooms, Taste the Difference"
FRTV,"Sainsbury's White Closed Cup Mushrooms, SO Organic 300g"
FRTV,Sainsbury's Chestnut Baby Button Mushrooms 200g
FRTV,"Sainsbury's Speciality Mushroom Mix, Taste the Difference"
FRTV,Sainsbury's Portabella Mushrooms 150g
FRTV,Tesco Closed Cup Mushrooms 400G
FRTV,Chestnut Mushrooms 250G
FRTV,Tesco Baby Button Mushrooms 200G
FRTV,Loose Closed Cup Mushrooms
FRTV,Tesco Sliced Mushrooms 250G
FRTV,Tesco Family Pack Chestnut Mushroom 485G
FRTV,Tesco Large Flat Mushrooms 250G
FRTV,Tesco Chestnut Baby Button Mushrooms 150G
FRTV,Tesco Sliced Mushrooms 500G
FRTV,Tesco Finest Portobello Mushrooms 150G
FRTV,Tesco Organic Chestnut Mushrooms 250 G
FRTV,Tesco Organic White Mushrooms 290G
FRTV,Tesco Mushroom Medley 500G
FRTV,Loose Brown Onions
FRTV,Tesco Brown Onions 1Kg
FRTV,Tesco Brown Onions Minimum 3 Pack 385G
FRTV,Loose Red Onions Class 2
FRTV,Tesco Red Onions 3Pack Minimum
FRTV,Tesco Red Onion 1Kg
FRTV,Tesco Diced Onions 500G
FRTV,Tesco Organic Brown Onion 750G
FRTV,Tesco Extra Large Brown Onions 2 Pack
FRTV,Tesco Shallots Onions 400G
FRTV,Tesco Diced Onion 400G
FRTV,Tesco Finest Rosanna Pink Onions 3Pack
FRTV,Redmere Farms Brown Onion 1Kg
FRTV,Tesco Red Organic Onions 500G
FRTV,Sainsbury's Spring Onions Bunch 100g
FRTV,Sainsbury's Onions Loose
FRTV,Sainsbury's Red Onions Loose
FRTV,Sainsbury's Brown Onions x3
FRTV,Sainsbury's Onions 1kg
FRTV,Sainsbury's Red Onions x3
FRTV,Sainsbury's Red Onions 1kg
FRTV,"Sainsbury's Salad Onions, Large 130g"
FRTV,"Sainsbury's Spring Onion Bunch, SO Organic 100g"
FRTV,"Sainsbury's Onions, SO Organic 750g"
FRTV,"Sainsbury's Diced Onions, Inspired to Cook 200g"
FRTV,"Sainsbury's Red Onions, SO Organic 500g"
FRTV,Red Peppers Each Class 1
FRTV,Nightingale Farms Peppers 375G
FRTV,Tesco Sweet Peppers 500G
FRTV,Green Peppers Each Class 1
FRTV,Sainsbury's Red Pepper
FRTV,Sainsbury's Sweet Peppers (Colours may vary) x3
FRTV,(Im)perfectly Tasty Peppers 500g
FRTV,Sainsbury's Yellow Pepper
FRTV,Sainsbury's Green Pepper
FRTV,Sainsbury's Orange Pepper
FRTV,"Sainsbury's Mixed Peppers, SO Organic x3 (Colours may vary)"
FRTV,"Sainsbury's Sweet Pointed Peppers, SO Organic x2 (Colours May Vary)"
FRTV,"Sainsbury's Baby Sweet Peppers, Taste the Difference 300g"
FRTV,"Sainsbury's Sweet Romano Peppers, Taste the Difference"
FRTV,"Sainsbury's Padron Peppers, Taste the Difference 135g"
FRTV,Sainsbury's Ricotta Stuffed Cherry Peppers 145g
FRTV,Sainsbury's Feta Stuffed Rainbow Cherry Peppers 145g
FRTV,Sainsbury's Cheese Stuffed Peppers 320g
FRTV,Tesco Baby Plum Tomatoes 325G
FRTV,Tesco Salad Tomatoes 6 Pack
FRTV,Tesco Finest Tomatoes On The Vine 450G
FRTV,Tesco Finest Piccobella Tomatoes 220G
FRTV,Tesco Sweet Vine Ripened Tomatoes 255G
FRTV,Tesco Finest Sugarbelle Tomatoes 400G
FRTV,Tesco Finest Mixed Baby Tomatoes 250G
FRTV,Tesco Tomatoes On The Vine 500G
FRTV,Tesco Cherry Tomatoes 330G
FRTV,Tesco Salad Tomatoes
FRTV,Tesco Finest Piccobella Tomatoes 400G
FRTV,Tesco Finest Sugarbelle Tomatoes 220G
FRTV,"Sainsbury's Majestic Vine Ripened Tomatoes, Taste the Difference 300g"
FRTV,"Sainsbury's Vittoria Cherry Vine Tomatoes, Taste the Difference 250g"
FRTV,"Sainsbury's Jubilee Large Vine Tomatoes, Taste the Difference 450g"
FRTV,Sainsbury's Cherry Tomatoes 500g
FRTV,Sainsbury's Classic Round Tomatoes x6
FRTV,Sainsbury's Baby Plum Tomatoes 325g
FRTV,"Sainsbury's Vittoria Cherry Vine Tomatoes, Taste the Difference 400g"
FRTV,"Sainsbury's Pomodorino Baby Plum Tomatoes, Taste the Difference 250g"
FRTV,Sainsbury's Cherry Tomatoes 330g
FRTV,Sainsbury's Large Vine Tomatoes 500g
FRTV,"Sainsbury's Best of British Tomatoes, Taste the Difference 250g"
FRTV,"Sainsbury's Sundream Plum Vine Tomatoes, Taste the Difference 250g"
FRTV,Sainsbury's Tomatoes Loose
FRTV,Imperfectly Tasty Cherry Tomatoes
FRTV,Sainsbury's Plum Tomatoes 500g
FRTV,Sainsbury's SO Organic Cherry on the Vine Tomatoes 200g
FRTV,"Sainsbury's Large Tomatoes, SO Organic 400g"
FRTV,"Sainsbury's Golden Vittoria Cherry Vine Tomatoes, Taste the Difference 250g"
FRTV,"Sainsbury's Pomodorino Tomatoes, SO Organic 225g"
FRTV,"Sainsbury's Cheriplum Tomatoes, Taste the Difference 250g"
FRTV,Tesco Tenderstem  Mixed Vegetables 160G
FRTV,Tesco Farmhouse Mixed Vegetables 1Kg
FRTV,Birds Eye Country Mixed Vegetables 640G
FRTV,Growers Harvest Mixed Vegetables 1Kg
FRTV,Tesco 4 Steam Bag Carrots Broccoli  Sweetcorn 640G
FRTV,Tesco Mixed Vegetables 1Kg
FRTV,Tesco Mixed Vegetables 225G
FRTV,Tesco Mediterranean Style Chargrilled Vegetables 700G
FRTV,Birds Eye Steamfresh 4 Family Favourite Mix Vegetable 540G
FRTV,Tesco Casserole Vegetables 1Kg
FRTV,Tesco 4 Steam Bags Rice With Mixed Vegetables 600G
FRTV,Tesco Carrot Cauliflower  Broccoli 370G
FRTV,Tesco Cauliflower  Broccoli Florets 400G M
FRTV,Birds Eye Family Favourites Steamfresh x4 540g
FRTV,Sainsbury's Mixed Vegetables 1kg
FRTV,Classic Vegetable Mix 1kg
FRTV,The Greengrocer Mixed Vegetables 1kg
FRTV,Birds Eye Country Mixed Vegetables 640g
FRTV,Birds Eye Select Mixed Vegetables 640g
FRTV,Sainsbury's Classic Vegetable Base Mix 1kg
FRTV,"Sainsbury's Mixed Vegetables, SO Organic 500g"
FRTV,Large Potatoes Baking Loose
FRTV,Tesco Baking Potatoes 25Kg Pack
FRTV,Tesco Finest Jacket Potatoes 4 Pack
FRTV,Tesco 4 Baking Potatoes
FRTV,Tesco Maris Piper Potatoes 25Kg
FRTV,Tesco All Rounder Potatoes 25Kg
FRTV,Tesco Finest Baby Potatoes 750G
FRTV,Tesco Finest Baby Potatoes 360G
FRTV,Tesco Baby Potatoes 1Kg
FRTV,Tesco Finest Jacket Potatoes 4 Pack
FRTV,Tesco Perfectly Imperfect Potatoes 25Kg
FRTV,Sainsbury's British Baking Potatoes x4
FRTV,Sainsbury's British Baking Potatoes Loose
FRTV,"Sainsbury's Vivaldi Baking Potatoes, Taste the Difference x4 (minimum)"
FRTV,Sainsbury's British Baking Potatoes 2.5kg
FRTV,Sainsbury's British Maris Piper Potatoes 2.5kg
FRTV,Sainsbury's British Baby Potatoes 1kg
FRTV,Sainsbury's British White Potatoes 2.5kg
FRTV,Sainsbury's British Mini Potatoes 750g
FRTV,Sainsbury's British Baking Potatoes Loose
FRTV,"Sainsbury's Vivaldi Baking Potatoes, Taste the Difference x4 (minimum)"
FRTV,Sainsbury's British King Edward Potatoes 2kg
FRTV,Sainsbury's British Baking Potatoes 2.5kg
FRTV,"Sainsbury's White Vivaldi Potatoes, Taste the Difference 2kg"
FRTV,Sainsbury's British Charlotte Potatoes 1kg
FRTV,Tesco Large Sweet Potatoes Loose Class 1
FRTV,Tesco Sweet Potatoes 1Kg
FRTV,Tesco Frozen Sweet Potato Chunks 600G
FRTV,Strong Roots Garlic Roasted Sweet Potato 500G
FRTV,Organic Sweet Potatoes 750G
FRTV,Tesco Butternut Squash  Sweet Potato 350G
FRTV,Tesco 2 Baking Sweet Potatoes
FRTV,Tesco Organic Baby Potatoes 750G
FRTV,Sainsbury's Sweet Potatoes Loose
FRTV,Sainsbury's Sweet Potato 1.25kg
FRTV,"Sainsbury's Sweet Potato, SO Organic 750g"
FRTV,Sainsbury's Baking Sweet Potatoes x2
FRTV,Sainsbury's White Flesh Sweet Potato 750g
CUFD,Nutribrex Gluten Free Cereal 375G
CUFD,Quaker Oat So Simple Gluten Free Original Porridge 10 Pack 350G
CUFD,Nairns Gluten Free Oat Muesli 450G
CUFD,Natures Path Organic Gluten Free Mesa Sunrise Cereal 355G
CUFD,Eat Natural Gluten Free Granola Buckwheat Seeds  Honey 425G
CUFD,Eat Natural Gluten Free Buckwheat Toasted Muesli 500G
CUFD,Eat Natural Gluten Free Ancient Grains Muesli 450G
CUFD,Quaker Oat So Simple Gluten Free Original Porridge 510G
CUFD,Free Gluten Free Supergrain Hoops Organic  Vegan 300G
CUFD,Nairns Gluten Free Scottish Porridge 450G
CUFD,Moma Jumbo Oat Porridge Almond Butter  Salted Caramel 6X35g
CUFD,Free Gluten Free Chocolate Stars Organic  Vegan 300G
CUFD,Tesco Free From Berry Granola 350G
CUFD,Tesco Free From Gluten Syrup Porridge Pot 55G
CUFD,Tesco Free From Original Porridge Pot 55G
CUFD,Delicious Alchemy Dairy  Gluten Free Oats450g
CUFD,Tesco Free From Multigrain Hoops 300G
CUFD,Sainsbury's Deliciously Free From Oats 450g
CUFD,Nature's Path Gluten Free Mesa Sunrise 355g
CUFD,Sainsbury's Deliciously Free From Fruity Muesli 450g
CUFD,Nairn's Gluten Free Scottish Porridge Oats 450g
CUFD,Sainsbury's Deliciously Free From Cornflakes 300g
CUFD,Nature's Path Gluten Free Granola Mixed Berry 312g
CUFD,Nairn's Gluten Free Oat Muesli 450g
CUFD,Sainsbury's Deliciously Free From Rice Pops 300g
CUFD,Kallo Organic Puffed Rice Cereal Gluten Free 225g
CUFD,Nutri-Brex Gluten Free Cereal x24 375g
CUFD,Go Free Gluten Free Corn Flakes 375g
CUFD,Go Free Gluten Free Honey Nut Flakes 350g
CUFD,Go Free Gluten Free Rice Pops 350g
CUFD,Sainsbury's Deliciously Free From Choco Flakes 300g
CUFD,Weetabix 48Pk
CUFD,Kelloggs Crunchy Nut 1Kg
CUFD,Kelloggs Frosties Cereal 925G
CUFD,Kelloggs Crunchy Nut 500G
CUFD,Jordans Country Crisp  Strawberry 500G
CUFD,Rice Krispies Multigrain Cereal 350G
CUFD,Quaker Oat So Simple Golden Syrup Porridge 57G
CUFD,Weetabix Cereal 24 Pack
CUFD,Tesco Scottish Oats Porridge 2Kg
CUFD,Tesco No Added Sugar Swiss Style Muesli 1Kg
CUFD,Tesco Instant Oats Porridge Pot Apple  Blueberry 55G
CUFD,Scotts Porridge Oats 1Kg
CUFD,Nature Valley Crunchy Granola Oats  Honey 5X42g
CUFD,Belvita Soft Bakes Chocolate Chip 250G
CUFD,Kelloggs Corn Flakes 720G
CUFD,Kelloggs Corn Flakes 500G
CUFD,Kelloggs Coco Pops Cereal Bar 6 X 20G
CUFD,Tesco Wheat Biscuits Cereal 24 Pack
CUFD,Tesco Easy Oats Golden Syrup Flavour 8X36g
CUFD,Weetabix Cereal x24
CUFD,Kellogg's Corn Flakes Breakfast Cereal 500g
CUFD,Sainsbury's Wholegrain Malties Cereal 750g
CUFD,Kellogg's Crunchy Nut Breakfast Cereal 720g
CUFD,Weetabix Cereal x48
CUFD,Sainsbury's Scottish Porridge Oats 1.5kg
CUFD,Sainsbury's Honey Nut Cornflakes 500g
CUFD,Kellogg's Fruit 'n Fibre Original Breakfast Cereal 700g
CUFD,Kellogg's Special K Original Breakfast Cereal 750g
CUFD,Cheerios Multigrain 700g
CUFD,"Sainsbury's Fruit, Nut & Seed Muesli 750g"
CUFD,Daily's Porridge Oats 1kg
CUFD,Kellogg's Frosties Breakfast Cereal 470g
CUFD,"Sainsbury's Granola, Raisin, Nut & Honey 1kg"
CUFD,Sainsbury's Rice Pops 375g
CUFD,Kellogg's Rice Krispies Breakfast Cereal 375g
CUFD,Flahavan's Organic Jumbo Oats 1kg
CUFD,Kellogg's Bran Flakes Breakfast Cereal 750g
CUFD,Nestle Shredded Wheat Bitesize Cereal 720g
CUFD,"Sainsbury's Whole Rolled Porridge Oats, Taste the Difference 750g"
CUFD,Quaker Oat So Simple Original Porridge Sachets 10x27g
CUFD,Alpen Muesli No Added Sugar 550g
CUFD,Scott's Porage Original Porridge Oats 1kg
CUFD,Shredded Wheat Cereal Biscuits x30
CUFD,Kellogg's Rice Krispies Breakfast Cereal 660g
CUFD,Sainsbury's Wholegrain Fruit & Fibre 750g
CUFD,Sainsbury's Choco Hazelnut Squares Cereal 375g
CUFD,Sainsbury's Choco Rice Pops 375g
CUFD,Tesco British Salted Block Butter 250G
CUFD,Tesco British Unsalted Butter 250G
CUFD,Anchor Salted Butter 200G
CUFD,Tesco Organic Butter 250G
CUFD,Tesco Organic Unsalted Butter 250G
CUFD,Kerrygold Pure Irish Block Butter 250G
CUFD,Yeo Valley Organic Block Butter 250G
CUFD,Lurpak Unsalted Butter 200G
CUFD,Lurpak Slightly Salted Spreadable 500G
CUFD,President Unsalted Butter 250G
CUFD,Lurpak Lighter Slightly Salted Butter 200G
CUFD,Lurpak Lighter Slightly Salted Spreadable 500G
CUFD,Flora Plant Butter Unsalted 250G
CUFD,"Sainsbury's British Butter, Salted 250g"
CUFD,Lurpak Slightly Salted Spreadable Blend of Butter & Rapeseed Oil 500g
CUFD,"Sainsbury's British Butter, Unsalted 250g"
CUFD,Lurpak Lighter Spreadable Blend of Butter & Rapeseed Oil 500g
CUFD,Sainsbury's Buttersoft Spreadable Butter 500g
CUFD,Anchor Spreadable Blend of Butter & Rapeseed Oil 500g
CUFD,Anchor Salted Butter 200g
CUFD,Kerrygold Pure Irish Butter 250g
CUFD,Country Life British Salted Butter 250g
CUFD,"Sainsbury's British Butter, Salted 500g"
CUFD,Lurpak Unsalted Spreadable Blend of Butter and Rapeseed Oil 500g
CUFD,Lurpak Slightly Salted Butter 200g
CUFD,"Sainsbury's British Butter Slightly Salted, SO Organic 250g"
