BAKA,Panini 4 Pack
CUFD,Lurpak Slightly Salted Spreadable Blend of Butter & Rapeseed Oil 250g
CUFD,"Sainsbury's British Butter Unsalted, SO Organic 250g"
CUFD,Kerrygold Softer Butter 250g
CUFD,Anchor Unsalted Butter 200g
CUFD,Anchor Spreadable Blend of Butter & Rapeseed Oil 750g
CUFD,Anchor Lighter Spreadable Blend of Butter & Rapeseed Oil 500g
CUFD,Lurpak Spreadable Blend of Butter and Rapeseed Oil 750g
CUFD,President Spreadable Slightly Salted Butter 250g
CUFD,Anchor Spreadable Blend of Butter & Rapeseed Oil 250g
CUFD,Lurpak Unsalted Butter 200g
CUFD,Vitalite Dairy Free Spread 500G
CUFD,Stockwell  Co Soft Spread 500G
CUFD,Pure Dairy Free Buttery Spread 500G
CUFD,I Cant Believe Its Not Butter Original Spread 450G
CUFD,Clover Original Spread 1Kg
CUFD,Stork Original Baking Spread 1Kg
CUFD,Tesco Buttery Spread 500G
CUFD,Pure Sunflower 500G
CUFD,Tesco Buttery Spread 1Kg
CUFD,I Cant Believe Its Not Butter Light Spread 450G
CUFD,Tesco Buttery Spread 30 Less Fat 500G
CUFD,Stork Original Baking Spread 500G
CUFD,Flora Buttery Spread 1Kg
CUFD,Tesco Baking Spread 500G
CUFD,Tesco Soft Baking Spread 2Kg
CUFD,Clover Original Spread 500G
CUFD,Clover Lighter Spread 500G
CUFD,Flora Light Spread 1Kg
CUFD,Tesco Baking Block 250G
CUFD,Stork Original Baking Block 250G
CUFD,Benecol Buttery Spread 500G
CUFD,Benecol Light Spread 500G
CUFD,Flora Pro Activ Light Spread 250G
CUFD,Clover Spread 500g
CUFD,Bertolli Olive Oil Spread 450g
CUFD,Clover Light Spread 500g
CUFD,Flora Natural Dairy Free Spread 450g
CUFD,Sainsbury's Butterlicious Spread 500g
CUFD,Flora Buttery Spread 450g
CUFD,Flora Lighter Vegan Spread 450g
CUFD,Sainsbury's Olive Spread 500g
CUFD,Benecol Buttery Spread 500g
CUFD,Vitalite Dairy Free Spread 500g
CUFD,Flora ProActiv Buttery Taste Spread 450g
CUFD,Flora Buttery Spread 1Kg
CUFD,Benecol Light Spread 500g
CUFD,Pure Dairy Free Vegan Olive Spread 500g
CUFD,Bertolli Olive Oil Light Spread 450g
CUFD,Sainsbury's Soft Baking Spread 500g
CUFD,Clover Spread 1kg
CUFD,Utterly Butterly Spread 500g
CUFD,Stork Baking Spread Alternative to Butter 1kg
CUFD,Flora Lighter Vegan Spread 1kg
CUFD,"Naturli Vegan Spread, Organic 450g"
CUFD,Benecol Olive Spread 500g
CUFD,Utterly Butterly Lightly Spread 500g
CUFD,Bertolli Spread 250g
CUFD,Flora Lighter Vegan Spread 250g
CUFD,Utterly Butterly Spread 1kg
CUFD,Sainsbury's Olive Spread 1kg
CUFD,Flora ProActiv Olive Spread 450g
CUFD,Clover Light Spread 1kg
CUFD,Tesco Olive Oil 1L
CUFD,Tesco Extra Virgin Olive Oil 1Ltr
CUFD,Filippo Berio Extra Virgin Olive Oil 1Ltr
CUFD,Tesco Olive Oil 250Ml
CUFD,Tesco Olive Oil 500Ml
CUFD,La Espanola Extra Virgin Olive Oil Litre
CUFD,Tesco Extra Virgin Olive Oil 250Ml
CUFD,Tesco Extra Virgin Olive Oil 500Ml
CUFD,Filippo Berio Extra Virgin Olive Oil 500Ml
CUFD,Filippo Berio Olive Oil 1 Litre
CUFD,Farchioni Il Casolare Extra Virgin Olive Oil 1L
CUFD,Napolina Extra Virgin Olive Oil 500Ml
CUFD,Tesco Light In Colour Olive Oil 1Ltr
CUFD,Napolina Extra Virgin Olive Oil 1Ltr
CUFD,Tesco Organic Extra Virgin Olive Oil 500Ml
CUFD,Napolina Olive Oil 500Ml
CUFD,Filippo Berio Mild  Light Olive Oil 1Ltr
CUFD,Napolina Olive Oil 1Lt
CUFD,Filippo Berio Pure Olive Oil 500 Ml
CUFD,Filippo Berio Mild  Light Olive Oil 500Ml
CUFD,Tesco Greek Extra Virgin Olive Oil 500Ml
CUFD,Napolina Olive Oil Spray 200Ml
CUFD,Belazu Crete Gold Extra Virgin Olive Oil 500Ml
CUFD,Napolina Extra Virgin Olive Oil 750ml
CUFD,Napolina Olive Oil 750ml
CUFD,"Sainsbury's Olive Oil, Extra Virgin 1L"
CUFD,Sainsbury's Olive Oil 1L
CUFD,Frylight 1 Cal Extra Virgin Olive Oil Cooking Spray 190ml
CUFD,Sainsbury’s Sunflower & Extra Virgin Olive Oil 500ml
CUFD,Sainsbury's Olive Oil 500ml
CUFD,"Sainsbury's Olive Oil, Extra Virgin 250ml"
CUFD,Il Casolare Unfiltered Extra Virgin Olive Oil 1L
CUFD,Filippo Berio Organic Extra Virgin Olive Oil 500ml
CUFD,"Sainsbury's Olive Oil, Extra Virgin 2L"
CUFD,"Filippo Berio Olive Oil, Extra Virgin 750ml"
CUFD,"Sainsbury's Unfiltered Extra Virgin Olive Oil, SO Organic 500ml"
CUFD,"Sainsbury's Garlic Flavoured Olive Oil, Inspired to Cook 250ml"
CUFD,Napolina Extra Virgin Olive Oil 500ml
CUFD,Sainsbury's Olive Oil 250ml
CUFD,Sainsbury's Extra Virgin Olive Oil Spray 200ml
CUFD,La Espanola Extra Virgin Olive Oil 750ml
CUFD,"Filippo Berio Olive Oil, Extra Virgin 500ml"
CUFD,Napolina Olive Oil 500ml
CUFD,"Sainsbury's Olive Oil, Light In Colour 1L"
CUFD,Karyatis Greek Extra Virgin Olive Oil 500ml
CUFD,Sainsbury's Olive Oil 2L
CUFD,"Sainsbury's Chilli Flavoured Olive Oil, Inspired to Cook 250ml"
CUFD,Filippo Berio Olive Oil 750ml
CUFD,Filippo Berio Extra Virgin Olive Oil 1L
CUFD,Odysea Greek Extra Virgin Olive Oil 500ml
CUFD,Filippo Berio Mild & Light Olive Oil 500ml
CUFD,Tesco Tuna Chunks In Spring Water 145G
CUFD,Tesco Tuna Chunks In Brine 145G
CUFD,Princes Tuna Chunks In Spring Water 4X145g
CUFD,Tesco Drained Tuna Steak In Spring Water 110G
CUFD,Stockwell  Co Tuna Chunks In Brine 145G
CUFD,Princes Tuna Chunks In Brine 4X145g
CUFD,Princes Tuna Chunks In Sunflower Oil 4X145g
CUFD,Tesco Tuna Chunks In Sunflower Oil 145G
CUFD,Tesco Drained Tuna Steak In Brine 110G
CUFD,Tesco Drained Tuna Steak In Sunflower Oil 110G
CUFD,Tesco Tuna Chunks In Spring Water 3X80g
CUFD,Princes Drained Tuna Steak In Spring Water 3X110g
CUFD,Rio Mare Tuna In Olive Oil 160G
CUFD,Princes Drained Tuna Steak In Sunflower Oil3x110g
CUFD,Princes Tuna Chunks In Spring Water 8 X 145G
CUFD,Princes Drained Tuna Steak In Brine 3X110g
CUFD,Princes Drained Tuna Steak In Spring Water 3X60g
CUFD,Princes Drained Tuna Steak In Sunflower Oil 3X60g
CUFD,Tesco Baked Beans In Tomato Sauce 420G
CUFD,Ortiz El Velero Yellow Fin Tuna in Olive Oil 112g
CUFD,Ortiz Bonito Tuna In Olive Oil 158g
CUFD,Sainsbury's Tuna Steak in Spring Water 3x120g
CUFD,Princes Tuna Chunks in Spring Water 4x145g
CUFD,Princes Tuna Chunks in Sunflower Oil 4x145g
CUFD,Sainsbury's Tuna Drained & Ready Water 120g
CUFD,John West No Drain Fridge Pot Tuna Steak with a Little Spring Water 3 x 110g
CUFD,John West Tuna Chunks in Spring Water 4x145g
CUFD,Princes Tuna Chunks in Brine 4x145g
CUFD,Princes Tuna Chunks in Spring Water 3x80g (3x56g*)
CUFD,Sainsbury's Tuna Steak in Sunflower Oil 3x120g
CUFD,John West No Drain Fridge Pot Tuna Steak with a Little Olive Oil 3 x 110g
CUFD,John West Immunity No Drain Tuna Steak with Springwater 3x110g
CUFD,John West Lower Salt Tuna Chunks in Spring Water 3x145g
CUFD,Princes Drained & Ready to Use Tuna Steak with a Little Spring Water 3x110g
CUFD,Heinz Baked Beans In Tomato Sauce 4X415g
CUFD,Branston Beans In Tomato Sauce 410G
CUFD,Heinz Baked Beans In Tomato Sauce 415G
CUFD,Heinz Beanz No Added Sugar 4 X 415G
CUFD,Heinz Baked Beans 3X200g
CUFD,Stockwell  Co Baked Beans In Tomato Sauce 420G
CUFD,Tesco Baked Beans In Tomato Sauce 220G
CUFD,Tesco Reduced Sugar And Salt Baked Beans In Tomato Sauce 420G
CUFD,Branston Beans In Tomato Sauce 220G
CUFD,Heinz Baked Beans No Added Sugar 4 Pack 4 X 200G
CUFD,Heinz Baked Beans No Added Sugar 415G
CUFD,Heinz Baked Beans In Tomato Sauce 150G
CUFD,Tesco Reduced Sugar  Salt Baked Beans 220G
CUFD,Heinz Baked Beans In Tomato Sauce 200G
CUFD,Tesco Baked Beans  Pork Sausages In Tomato Sauce 395G
CUFD,Heinz Beanz Snap Pots 4X200g
CUFD,Heinz Baked Beans  Pork Sausages 415G
CUFD,Heinz Beanz No Added Sugar 200G
CUFD,Stockwell  Co Baked Beans  Pork Sausages 405G
CUFD,Tesco Organic Baked Beans 420G
CUFD,Branston Beans  Sausages 405G
CUFD,Heinz Beanz Barbecue 390G
CUFD,Del Monte Fruit Cocktail In Juice 415G
CUFD,Heinz Baked Beans in a Rich Tomato Sauce 4 x 415g
CUFD,Heinz Baked Beans in a Rich Tomato Sauce 6 x 415g
CUFD,Heinz No Added Sugar Baked Beans in a Rich Tomato Sauce 6 x 415g
CUFD,Hubbard's Foodstore Baked Beans In Tomato Sauce 400g
CUFD,Heinz Baked Beans in a Rich Tomato Sauce 3 x 200g
CUFD,Sainsbury's Baked Beans In Tomato Sauce 200g
CUFD,Heinz Baked Beans in a Rich Tomato Sauce 415g
CUFD,Branston Baked Beans 4x410g
CUFD,"Sainsbury's Baked Beans In Reduced Sugar & Salt, Tomato Sauce 200g"
CUFD,Sainsbury's Baked Beans In Tomato Sauce 4x400g
CUFD,Sainsbury's Reduced Sugar & Salt Baked Beans In Tomato Sauce 4x400g
CUFD,Sainsbury's Reduced Sugar & Salt Baked Beans In Tomato Sauce 400g
CUFD,Heinz Baked Beans Snap Pots 4 x 200g
CUFD,Sainsbury's Baked Beans 6x400g
CUFD,Heinz Baked Beans in a Rich Tomato Sauce 200g
CUFD,Heinz Baked Beans in a Rich Tomato Sauce 150g
CUFD,Branston Baked Beans 220g
CUFD,Sainsbury's Baked Beans in Tomato Sauce 400g
CUFD,Branston Baked Beans in a Rich & Tasty Tomato Sauce 6x410g
CUFD,Heinz Baked Beans and Sausages 415g
CUFD,Heinz No Added Sugar Baked Beans in a Rich Tomato Sauce 4 x 415g
CUFD,Heinz Baked Beans and Pork Sausages 200g
CUFD,Heinz No Added Sugar Baked Beans in a Rich Tomato Sauce 415g
CUFD,"Sainsbury's Baked Beans, SO Organic 400g"
CUFD,Branston Baked Beans 410g
CUFD,Heinz No Added Sugar Baked Beans in a Rich Tomato Sauce 200g
CUFD,Sainsbury's Baked Beans With Meatfree Meat Free Sausages 400g
CUFD,Branston Baked Beans & Sausages 405g
CUFD,HP Baked Beans 4x415g
CUFD,Heinz Baked Beans Barbecue 390g
CUFD,Del Monte Peach Slices In Juice 415G
CUFD,Tesco Tropical Fruit Salad 425G
CUFD,Tesco Evaporated Milk 410G
CUFD,Del Monte Fruit Cocktail In Syrup 420G
CUFD,Tesco Pineapple Slices In Natural Juice 227G
CUFD,Tesco Pear Halves In Juice 410G
CUFD,Tesco Pineapple Slices In Juice 425G
CUFD,Princes Summer Fruit Filling 410G
CUFD,Del Monte Peach Halves In Juice 415G
CUFD,Del Monte Pineapple Chunks In Juice 432G
CUFD,Del Monte Sliced Pineapple In Juice 435G
CUFD,Tesco Basmati Rice 1Kg
CUFD,Sainsbury's Peach Slices In Fruit Juice 411g
CUFD,Sainsbury's Prunes in Fruit Juice 410g
CUFD,Sainsbury's Pineapple Chunks in Fruit Juice 432g
CUFD,Del Monte Fruit Cocktail In Juice 415g (250g Drained)
CUFD,Sainsbury's Apricot Halves in Fruit Juice 411g
CUFD,Sainsbury's Mandarin Segments in Fruit Juice 298g
CUFD,Sainsbury's Pear Halves in Refined Fruit Juice 411g
CUFD,Sainsbury's Peach Slices In Fruit Juice 213g
CUFD,Dole Peaches In Juice Fruit Snacks 4x113g
CUFD,Tesco Microwave Basmati Rice 250G
CUFD,Tesco Basmati Rice 2Kg
CUFD,Tesco Basmati Rice 4Kg
CUFD,Laila Basmati Rice 10Kg
CUFD,Tilda Pure Original Basmati Rice 10Kg
CUFD,Tilda Basmati Rice 1Kg
CUFD,Tilda Pure Steamed Basmati Rice Classic 250G
CUFD,Akash Basmati Rice 10Kg
CUFD,Growers Harvest Microwave Basmati Rice 250G
CUFD,Tilda Basmati Rice 500G
CUFD,Tilda Pure Original Basmati Rice 5Kg
CUFD,Laila Basmati Rice 5Kg
CUFD,Tesco Easy Cook Basmati Rice 1Kg
CUFD,Kohinoor Extra Flavour Basmati Rice 10Kg
CUFD,Tesco Boil In The Bag Basmati Rice 4 X 125G
CUFD,Badshah Superior Aged Basmati Rice 5Kg
CUFD,Kohinoor Classic Basmati Rice 10Kg
CUFD,Akash Gold Basmati Rice 10Kg
CUFD,Laila Basmati Rice 2Kg
CUFD,Tesco Organic Basmati Rice 500G
CUFD,Tesco Jasmine Rice 1Kg
CUFD,Ben's Original Classic Basmati Microwave Rice 220g
CUFD,Sainsbury's Microwave Rice Basmati 250g
CUFD,Sainsbury's Basmati Rice 1kg
CUFD,Tilda Microwave Rice Pure Basmati 250g
CUFD,Sainsbury's Microwave Rice Brown Basmati 250g
CUFD,Tilda Microwave Rice Wholegrain Basmati 250g
CUFD,Tilda Microwave Rice Lime & Coriander Basmati 250g
CUFD,Tilda Microwave Rice Pilau Basmati 250g
CUFD,Tilda Pure Basmati Rice 500g
CUFD,Sainsbury's Basmati Rice 500g
CUFD,Tilda Pure Basmati Rice 1kg
CUFD,Sainsbury's Boil In The Bag Basmati Rice 4x125g
CUFD,Veetee Heat& Eat Basmati Rice Pots x2 250g
CUFD,Tilda Microwave Rice Wholegrain Pilau Basmati 250g
CUFD,Tilda Wholegrain Basmati Rice 1kg
CUFD,Sainsbury's Basmati Rice 2kg
CUFD,Tilda Pure Basmati Rice 5kg
CUFD,Laila Basmati Rice 5kg
CUFD,Tilda Boil in Bag Pure Basmati Rice 250g
CUFD,Trophy Indian Basmati Rice 10kg
CUFD,Tilda Pure Basmati Rice 2kg
CUFD,Tesco Thai Hom Mali Aaa Jasmine Fragrant Rice 5Kg
CUFD,Tilda Thai Jasmine Rice 500G
CUFD,Tesco Microwave Jasmine Rice 250G
CUFD,Tilda Jasmine Fragrant Rice 250G
CUFD,Veetee Heat Eat Thai Jasmine Rice 2X140g
CUFD,Royal Umbrella Thai Jasmine Rice 1Kg
CUFD,Bens Original Long Grain Rice 500G
CUFD,Mai Thai AAA Jasmine Fragrant Rice 5kg
CUFD,Veetee Heat& Eat Thai Jasmine Rice Pots 280g
CUFD,Tilda Fragrant Jasmine Rice 500g
CUFD,Sainsbury's Microwave Rice Brown 250g
CUFD,Tesco Tuna Chunks In Sunflower Oil 400G
CUFD,Bens Original Classic Long Grain Microwave Rice 220G
CUFD,Tesco Easy Cook Long Grain Rice 1Kg
CUFD,Tesco Microwave Long Grain Rice 250G
CUFD,Grower Harvest Long Grain Rice 1Kg
CUFD,Tesco Easy Cook Rice 2Kg
CUFD,Tesco Organic Easy Cook Long Grain Rice 500G
CUFD,Tesco Easy Cook Long Grain Rice 4Kg
CUFD,Ben's Original Classic Long Grain Microwave Rice 220g
CUFD,Sainsbury's Microwave Rice Long Grain White 250g
CUFD,Sainsbury's Easy Cook Long Grain White Rice 1kg
CUFD,Sainsbury's Long Grain Rice 1kg
CUFD,Bens Original Boil in Bag Long Grain Rice 8x62.5g
CUFD,Sainsbury's Easy Cook Long Grain White Rice 2kg
CUFD,Sainsbury's Easy Cook Long Grain White Rice 500g
CUFD,Bens Original Long Grain Rice 1kg
CUFD,Veetee Heat& Eat Long Grain Rice Pots x2 260g
CUFD,Tilda Microwave Rice Premium USA Long Grain 250g
CUFD,Liberty Easy Cook Long Grain Rice 5kg
CUFD,Sainsbury's Long Grain Rice 2kg
